id,title,selftext,score,created,permalink,author,num_comments,link_id,parent_id,body
mtp347b,,,1,2025-05-22T13:10:08,,AcidBunnyAdonis,,t3_1ksxhvk,t3_1ksxhvk,"The clutch is very reactive and precise and it's operated by a paddle on the steering wheel rather as a pedal, so it isn't immediately intuitive."
mtp4aic,,,1,2025-05-22T13:15:45,,MinimumIcy1678,,t3_1ksxhvk,t3_1ksxhvk,"Those V10s and V8s actually had very limited torque.

And a tiny hand clutch with zero feel."
1kt3ge2,Ex-Alpine F1 boss stands by Piastri ‘integrity’ jab,,38,2025-05-22T17:08:30,/r/formula1/comments/1kt3ge2/exalpine_f1_boss_stands_by_piastri_integrity_jab/,TheFlyingR0cket,51.0,,,
mtqf4k6,,,1,2025-05-22T17:08:31,,AutoModerator,,t3_1kt3ge2,t3_1kt3ge2,"[The **News** flair](https://www.reddit.com/r/formula1/wiki/flairguide#wiki_news) is reserved for submissions covering F1 and F1-related news. These posts must always link to an outlet/news agency, the website of the involved party (i.e. the McLaren website if McLaren makes an announcement), or a tweet by a news agency, journalist or one of the involved parties.

*[Read the rules](https://www.reddit.com/r/formula1/wiki/userguide). Keep it civil and welcoming. Report rulebreaking comments.*

*I am a bot, and this action was performed automatically. Please [contact the moderators of this subreddit](/message/compose/?to=/r/formula1) if you have any questions or concerns.*"
mtqg0qo,,,1,2025-05-22T17:13:27,,slimslima,,t3_1kt3ge2,t3_1kt3ge2,I am sure Piastri is feeling at peace with his decision lol
mtqh9ce,,,1,2025-05-22T17:20:21,,baaananaramadingdong,,t3_1kt3ge2,t3_1kt3ge2,"Yeah, shoulda signed him but didn't. Integrity means nothing in F1 and he bloody-well knew it.  Alpine played themselves."
mtqh26p,,,1,2025-05-22T17:19:14,,aamgdp,,t3_1kt3ge2,t3_1kt3ge2,">We ran Oscar in over 5000km in a two-year-old car. That was a significant amount of money – millions to do that.

>If Oscar knew that he was using Alpine to get that mileage under his belt and seat time … knowing he was off to McLaren, that’s what I meant by that.

>And, no, I don’t regret saying that.

>Szafnauer said it was dishonest of Piastri to continue testing with the team while the McLaren carrot was dangling, knowing of the possibility of an impending switch.

>If you spot an opportunity like that, and you think you can get them as they did, that’s OK. No

>It’s just this notion of undue enrichment, [where] you take part of a contract on one hand, and then you don’t fulfil your bit of the contract.

>You have a contract, say it’s not signed properly, you know that, but the other side is delivering their end of the bargain of that contract, and you have no intention on delivering yours.

>What you should do is say, ‘you know what, keep your test days. I’m not gonna do this. I’m gonna go over here

Lmao. He's still on this. I mean... You don't want Oscar to leave, it's not hard to do... They basically begged for months to have contract to sign."
mtqomac,,,1,2025-05-22T18:01:49,,Zinthar,,t3_1kt3ge2,t3_1kt3ge2,"Otmar continues to lie about the contract. Per the CRB’s decision, Alpine had done nothing to secure Oscar’s services beyond his 2022 reserve duties other than make empty promises about a seat at Williams that wasn’t theirs to give.

Alpine fully expected to retain Alonso for another season  before putting Piastri in that seat and were trying to play Alonso’s & Piastri’s camps against each other to secure more advantageous contract terms, which is why they entered summer break 2022 with neither under contract for 2023. 

Otmar needed to throw Piastri under the bus to deflect from his own incompetence as Alpine TP. And now of course he doubles down on it. He has no integrity, is nothing more than an empty suit, and should never work in Formula 1 again. It is amusing, though, to see him flail about trying to keep relevant by popping up at races occasionally and giving interviews."
mtqiguk,,,1,2025-05-22T17:27:09,,BoxBoxBox81,,t3_1kt3ge2,t3_1kt3ge2,This is why Piastri's mother was liking every Otmar downfall post on Twitter when he was fired.
mtqh2f4,,,1,2025-05-22T17:19:17,,darklordjames,,t3_1kt3ge2,t3_1kt3ge2,What a butt ass.
mtr0k3o,,,1,2025-05-22T19:10:37,,Reebz0r,,t3_1kt3ge2,t3_1kt3ge2,"Same team that booted Ocon to run Doohan, only to leave Doohan hanging when Colapinto suddenly became available. 


Hell from what I remember the whole reason they had Piastri hanging is because they were trying to re-sign Alonso."
mtqhhyu,,,1,2025-05-22T17:21:43,,TheFlyingR0cket,,t3_1kt3ge2,t3_1kt3ge2,Alpine talking about integrity is super funny.
mtqfvjc,,,1,2025-05-22T17:12:41,,BatmanBecameSomethin,,t3_1kt3ge2,t3_1kt3ge2,"Piastri is on his way to winning a WDC, where is Alpine?"
1kt0sop,F1 Bingo Round 8- Monaco- Prediction Game Link in Comments,,44,2025-05-22T15:18:14,/r/formula1/comments/1kt0sop/f1_bingo_round_8_monaco_prediction_game_link_in/,Farrisioso,6.0,,,
mtpthyd,,,1,2025-05-22T15:18:16,,AutoModerator,,t3_1kt0sop,t3_1kt0sop,"[The **Statistics** flair](https://www.reddit.com/r/formula1/wiki/flairguide#wiki_statistics) is reserved for posts highlighting interesting statistics. As a rule of thumb, Statistics posts need to inform readers through visualizations and insights that cannot be obtained from raw data alone. For example, a post containing a qualifying gap between two drivers expressed in tenths of a second is an easily obtainable raw piece of data and constitutes a bad Statistics post. A visualization of what that translates to on-track, or visualization of how that gap came to be would constitute a good Statistics post.

*[Read the rules](https://www.reddit.com/r/formula1/wiki/userguide). Keep it civil and welcoming. Report rulebreaking comments.*

*I am a bot, and this action was performed automatically. Please [contact the moderators of this subreddit](/message/compose/?to=/r/formula1) if you have any questions or concerns.*"
mtptl16,,,1,2025-05-22T15:18:40,,Farrisioso,,t3_1kt0sop,t3_1kt0sop,[here is the link to the prediction game](https://docs.google.com/forms/d/e/1FAIpQLSdN6KQZQ_hdybO-ttMgYhp75kYDtByYfmrWbVxxoo0b1GxgHg/viewform?usp=header)
mtpybj6,,,1,2025-05-22T15:41:25,,micknick0000,,t3_1kt0sop,t3_1kt0sop,Still no Colapinto square...
mtqgrdn,,,1,2025-05-22T17:17:34,,queerhedgehog,,t3_1kt0sop,t1_mtpybj6,"? Only 8 drivers have specific squares. There’s an Alpine points square, and Franco can also qualify for any of the DNFs, red flags, or penalties."
mtqipq5,,,1,2025-05-22T17:28:33,,Alteredbeast1984,,t3_1kt0sop,t1_mtqgrdn,I love your unbridled optimism
1ksclh7,F1: The Movie expanding to more IMAX theatres due to overwhelming popularity,,1854,2025-05-21T18:39:14,/r/formula1/comments/1ksclh7/f1_the_movie_expanding_to_more_imax_theatres_due/,thermal7,242.0,,,
mtkdee4,,,1,2025-05-21T18:39:14,,AutoModerator,,t3_1ksclh7,t3_1ksclh7,"[The **News** flair](https://www.reddit.com/r/formula1/wiki/flairguide#wiki_news) is reserved for submissions covering F1 and F1-related news. These posts must always link to an outlet/news agency, the website of the involved party (i.e. the McLaren website if McLaren makes an announcement), or a tweet by a news agency, journalist or one of the involved parties.

*[Read the rules](https://www.reddit.com/r/formula1/wiki/userguide). Keep it civil and welcoming. Report rulebreaking comments.*

*I am a bot, and this action was performed automatically. Please [contact the moderators of this subreddit](/message/compose/?to=/r/formula1) if you have any questions or concerns.*"
mtkk54i,,,1327,2025-05-21T19:18:12,,ClutchPower,,t3_1ksclh7,t3_1ksclh7,“activate DRS” flames start shooting out mid race
mtlix9y,,,655,2025-05-21T22:46:28,,Schowzy,,t3_1ksclh7,t3_1ksclh7,You think there'll be a scene where Brad Pitt swears on the radio and gets fined by MBS?
mtlbsri,,,356,2025-05-21T22:00:07,,Apyan,,t3_1ksclh7,t3_1ksclh7,"As the circle of life continues, we're about to see the Drive to Survive fans complaining about the people that only started watching F1 because of Brad Pitt."
mtlicp5,,,291,2025-05-21T22:42:30,,stolemyusername,,t3_1ksclh7,t3_1ksclh7,"If the movie isn't about tire management, with whoever leads after lap 1 winning by 25+ seconds by virtue of having clean air, I don't want to see it."
mtkeh5f,,,345,2025-05-21T18:45:21,,lam3ass,,t3_1ksclh7,t3_1ksclh7,Probably because the theater owners want to expand it
mtm148d,,,59,2025-05-22T01:14:46,,Francoberry,,t3_1ksclh7,t3_1ksclh7,We always joke about Hakkinen coming out of his sabbatical despite his age - Brad Pitt is _older_ than Mika 🤯
mtktjhf,,,456,2025-05-21T20:12:54,,Prayaa,,t3_1ksclh7,t3_1ksclh7,Love how people are so cynical about a movie about racing lmao. Either watch it and enjoy it for what it is or move on with your life. It isn’t even out yet.
mtl5i4e,,,169,2025-05-21T21:22:49,,Annual_Plant5172,,t3_1ksclh7,t3_1ksclh7,I don't understand why F1 fans are being so weird about this. If you don't think you're going to like it then just don't watch? It's crazy how many people think it's going to be shit despite it not even being released yet.
mtm14ym,,,8,2025-05-22T01:14:57,,Wild_Basil_2396,,t3_1ksclh7,t3_1ksclh7,I lowkey think MBS has had his fair share of screen time.
1ksvf99,"The Grand Prix du Monaco - A writeup/pictorial of the 1960 Monaco Grand Prix from the June 1961 issue of Playboy magazine (SFW), with bonus letter to the editor by one Stirling Moss!",,74,2025-05-22T11:41:55,/r/formula1/comments/1ksvf99/the_grand_prix_du_monaco_a_writeuppictorial_of/,BobdaWalrus,9.0,,,
mtokcmo,,,1,2025-05-22T11:41:56,,AutoModerator,,t3_1ksvf99,t3_1ksvf99,"[The **Throwback** flair](https://www.reddit.com/r/formula1/wiki/flairguide#wiki_throwback) is for posts intended to recall an event that happened on the same date or year a number of years ago. Throwbacks are restricted to being posted one year, three years, or a multiple of five years after date. Also, all such posts should feature an event that is still of interest to the general community today. For example, random overtakes or two former drivers having a chat in general do not qualify for this. Important events like memorials are exempt from this rule, and may be posted every year. Posts related to important current events may also be exempt at mod discretion.

*[Read the rules](https://www.reddit.com/r/formula1/wiki/userguide). Keep it civil and welcoming. Report rulebreaking comments.*


*I am a bot, and this action was performed automatically. Please [contact the moderators of this subreddit](/message/compose/?to=/r/formula1) if you have any questions or concerns.*"
mtomer7,,,1,2025-05-22T11:51:43,,BobdaWalrus,,t3_1ksvf99,t3_1ksvf99,"~~I'll add a transcription of the article shortly, but I have to do it manually because my attempts to pull the text automatically fucked the text up something awful~~

done"
mton56k,,,1,2025-05-22T11:55:07,,PS_FOTNMC,,t3_1ksvf99,t3_1ksvf99,So Stirling read it for the articles?
mtp452g,,,1,2025-05-22T13:15:02,,,,t3_1ksvf99,t3_1ksvf99,[removed]
mtopd3x,,,1,2025-05-22T12:05:42,,IdiosyncraticBond,,t3_1ksvf99,t1_mton56k,Didn't we all?
mtp47v0,,,1,2025-05-22T13:15:24,,,,t3_1ksvf99,t1_mtp452g,[removed]
mtplwf9,,,1,2025-05-22T14:41:21,,,,t3_1ksvf99,t1_mtp47v0,[removed]
mtptnlv,,,1,2025-05-22T15:19:01,,BobdaWalrus,,t3_1ksvf99,t1_mtplwf9,"Part Four:

Nor was the race itself a disappointment. As we sat on the terrace of the Hôtel de Paris, sipping Cinzano, we joined in the classic pre-event speculation: Who would come through first in that hell-for-leather opening lap? Moss, surely. Or Brabham. But which? The city hushed. The engines were started, a sound of sixteen angry lions. The starter began to count down. Off beyond our vision, a flag was dropped. The loudspeakers exploded, a babel of French and English lost under the thunder of accelerating machines. The street before us was empty. There was that long, delicious, agonizing, moment of suspense, then the ferocious sound of the cars as they rocketed up the hill and toward the hotel turn.

"" Is it Moss?""

"" Is it Brabham?""

Neither. The first car around, bellowing as it sank its fingernails into the cement, was a lo-slung, dark-blue BRM, and the driver was Sweden’s champion, Joakim Bonnier. Snapping at his heels was Jack Brabham, in a Cooper, and joined to Brabham was the Lotus of Stirling Moss. A few yards behind came the British dental surgeon Tony Brooks and the young ace whose career ended tragically a week later at Spa-Francorchamps. Chris Bristow. Then the rest of the pack. snarling and pushing. Baron Wolfgang Berghe Graf von Trips, known to intimates as Taffy, or von Crash, provided momentary horror as his Ferrari burst into flames. Von Trips might have evacuated the machine, but chose instead a different method. He went so fast toward Beau Rivage that the downrush of air simply blew out the fire. He continued in ninth place.

Meanwhile, Bonnier was building his lead. The BRM had a reputation for unreliability, but while it kept together it was a formidable machine. To anyone unfamiliar with its history of burst engines and broken suspensions, it must have seemed unbeatable. And so it was, for a great many laps. Then Moss decided it was time to stop hanging about. He passed Brabham and took after Bonnier. At the ten-lap mark, the bearded Swede led by just 0.8 second.

As if this were not exciting enough, races within races were going on back in the field. Phil Hill was whipping his immense Ferrari past car after car, and was now preparing to bull by Brooks. Little Richie Ginther, of California, had a handful with his rear-engine prototype, hut he was driving smoothly and the experimental Ferrari was ahead of several lighter, faster machines.

On lap seventeen Moss roared into the lead and began to pull away. Then Brabham passed Bonnier, and the stage was set for another battle of the giants. But Bonnier refused to cooperate. He went by Brabham and set off after Moss, who was now 4.7 seconds ahead. All three were traveling at an average speed which was considerably faster than the lap records of other years.

Then it began to rain. To the spectators this was a mild discomfort; to the drivers, a nightmare. The streets became spippery as oiled glass. A feeling of dread crept into the air, as the inevitable incidents started. Roy Salvadori went by his pits indicating that he would need a visor. Suddenly his Cooper slid out of control and collided viciously with the barriers at the Virage des Gazomêtres. Phil Hill tried to hang onto his brute arround the Casino bend, lost it, got it back somehow, and slithered on. Brabham the CarefuI was suddenly going like a madman. He got closer to Moss every lap, then, on the thirty-fourth, passed into the lead, which he began to stretch. Moss was expected to attack, but he did not. Perhaps he knew what was going to happen. It is difficult to explain otherwise how he was able to avoid disaster. For on the forty-first lap. Brabham spun. Moss came around Sainte-Dévôte to findthe lead Cooper revolving wildly. An accident seemed inevitable, but Moss gave the wheel a quick flick, missed the gyrating Cooper by millimeters, and went through. Brabham ended his race against the retaining wall

And still rained. Dark mist capped the terraced hills, turning the bright houses gray. We sat wondering now, with everyone else, if Moss had beaten his jinx. His lead seemed unassailable, yet –

On the sixtieth lap the dark-blue Lotus failed to come around. The crowd groaned. Moss was out of it, cheated again. But only for a few moments. He had had stopped at the pits when the power had begun to fail in his engine. A plug lead had come adrift. Moss replaced it himself and continued.
More incidents occurred. McLaren lost control of his Cooper, allowing Phil Hill and Graham Hill to catch up. Then Graham Hill lost his BRM, crashing into the Radio Monte-Carlo commentary box and all but demolishing the building – fortunately with no serious harm to anyone.

Now the rain slacked off. Moss turned a number of incredible laps below one minute 36.8, under the mistaken impression that he had only five instead of thirty-five to go, then settled into a steady winning pace. Bonnier dropped out, after a fine run. Gurney, never confident of the car, brought his BRM into the pits with broken suspension. Other machines limped in, like cripples, or stopped dead.

The spectators were all cheering for Moss, praying that nothing would happen to stop a well-deserved victory. Nothing did. The checkered flag fell on the dark-blue Lotus, and Stirling Moss won the Eighteenth Grad Prix de Monaco at 67.68 mph by 52.1 seconds from Bruce McLaren (Cooper-Climax), who was followed home by Phil Hill (Ferrari) and Tony Brooks (Yeoman Credit Cooper).

Moss was buried in roses. The little Lotus, which had gone so fast, sputtered around the city for its victory lap, and you could see only the roses and the driver’s happy smile. The G.P. was over. The sky turned gray, and the rain began to fall again in a silver mist. And all that was left of the danger and the excitement now were three broken rose petals, glowing red in the dark street.

But the festival was not yet completed. For now it was time for the traditional gala. The drivers went to their hotels, scrubbed the grease and oil from their skin, doffed their racing overalls, donned their soup-and-fish and scurried over to the Hotel de Paris. We joined them in the Empire Room, and marveled at the transformation that had taken place. No longer were they heroes and fools. They were young men having a spree. Deadly enemies only a few hours earlier, the pilotos were now gathered in wild camaderie on the dance floor of the elegant Empire Room, dancing mambos, trading partners, and generally having a hell of a time. Traditionally, the Prince and Princess joined the celebration, but they didn’t slow it down. The regal, ermine-cool Grace made an entrance out of The Prisoner of Zenda – slow drum roll, crowd standing at attention – but very soon she melted and joined the mad melee on the floor, which lasted until dawn.

They’ll be dancing there again this year. The streets will thunder again, and again there will be the thrill of speed, the joy of victory and the bitter challenge of defeat. Hard as it is to imagine, the festival will probably be greater than ever. Porsches will be joining the fray, Ferrari will have its super-light, 290-horsepower threat, and you may be sure the Coopers and Lotuses won’t be slower, and maybe the new rear-engine Scarabs will be ready. You can never be sure about Grand Prix racing."
mtpu0e9,,,1,2025-05-22T15:20:45,,BobdaWalrus,,t3_1ksvf99,t1_mtptnlv,"From the August 1961 *Dear Playboy*

> l enjoyed the Monaco article and applaud its accuracy; the color was excellent. I have often thought that PLAYBOY should sponsor a racing car, because your motif would look rather good on its side.
> 
Stirling Moss
> 
London, England
> 
> We hereby award one PLAYBOY rabbit to uncrowned champion Moss to put on the friskiest car in his scuderia. [Editor]"
1ksz2tc,F1 Bingo Round 7- Imola Results- Full Standings for Competition in Comments,,43,2025-05-22T14:08:19,/r/formula1/comments/1ksz2tc/f1_bingo_round_7_imola_results_full_standings_for/,Farrisioso,12.0,,,
mtpf6zk,,,1,2025-05-22T14:08:21,,AutoModerator,,t3_1ksz2tc,t3_1ksz2tc,"[The **Statistics** flair](https://www.reddit.com/r/formula1/wiki/flairguide#wiki_statistics) is reserved for posts highlighting interesting statistics. As a rule of thumb, Statistics posts need to inform readers through visualizations and insights that cannot be obtained from raw data alone. For example, a post containing a qualifying gap between two drivers expressed in tenths of a second is an easily obtainable raw piece of data and constitutes a bad Statistics post. A visualization of what that translates to on-track, or visualization of how that gap came to be would constitute a good Statistics post.

*[Read the rules](https://www.reddit.com/r/formula1/wiki/userguide). Keep it civil and welcoming. Report rulebreaking comments.*

*I am a bot, and this action was performed automatically. Please [contact the moderators of this subreddit](/message/compose/?to=/r/formula1) if you have any questions or concerns.*"
mtpif4j,,,1,2025-05-22T14:24:07,,SissyForLeclerc,,t3_1ksz2tc,t3_1ksz2tc,"Need to add ""DC hits on Lando"" for this week"
mtpvklu,,,1,2025-05-22T15:28:14,,StevenMC19,,t3_1ksz2tc,t3_1ksz2tc,"Teeeechnically we didn't get the free space as Crofty wasn't in the booth. lol

We got ""All eyes on the lights!"""
mtpfaff,,,1,2025-05-22T14:08:49,,Farrisioso,,t3_1ksz2tc,t3_1ksz2tc,[here is the link to the full standings](https://docs.google.com/spreadsheets/d/1xEXF85ntXu4zyaQwZvl1-5drvZ86xTrV7C_8JqXTsVY/edit?usp=drivesdk)
mtpjksq,,,1,2025-05-22T14:29:49,,Maybe-Nice,,t3_1ksz2tc,t3_1ksz2tc,Not bad for me this round.
mtq3hes,,,1,2025-05-22T16:06:44,,deathray1611,,t3_1ksz2tc,t3_1ksz2tc,"16 pts this round, and an improvement on the last. Not bad, not bad I say. Still in the fight"
mtpuyrr,,,1,2025-05-22T15:25:20,,Tfc-Myq,,t3_1ksz2tc,t3_1ksz2tc,too much antonelli hopium hurt my haul but not too bad
mtpx1h7,,,1,2025-05-22T15:35:17,,MaximumVibe,,t3_1ksz2tc,t3_1ksz2tc,Ferrari has some sort of mishap may as well be the free space
mtpog70,,,1,2025-05-22T14:53:52,,Other_eXec,,t3_1ksz2tc,t1_mtpfaff,How does one get negative points?
mtrdrqp,,,1,2025-05-22T20:30:05,,peppy_snow,,t3_1ksz2tc,t1_mtpjksq,what is ur rank
1ksovbx,Verstappen v. Alonso at Monaco Q3 2023: Sector of the gods.,"Approaching Sainte Devote (T1), ALO got off the throttle later and braked later than VER, but the latter carried more speed through Rivage (T2) and got off the throttle later at Massenet (T3). ALO gained some speed on VER between Massenet and Casino (T4), but the most significant gain was inbetween Casino and Mirabeau (T5). At this point, VER was 0.146sec behind ALO.   
VER gained some speed on ALO between Mirabeau and the Hairpin (T6), but failed to make advancements at the Hairpin, second Mirabeau (T7), Portier (T8) and through the tunnel (T9). Worse, ALO had a better approach of Nouvelle (T10&11), carrying more top speed into Tabac (T12), where he also made a better approach with lifting later. VER was then, after Tabac and the end of sector 2, 0.204sec behind ALO.   
Going into the swimming pool, VER hustled through T13&14, gaining some speed on ALO. Taking also a bit more speed through T15&16 and having a higher top speed exiting T17. Inbetween Rascasse (T18) and the final turn, T19, VER stepped onto the gas slightly more than ALO, allowing for a better exit out of the final turn.   
In the final sector, VER gained 0.288sec on ALO, securing pole position by 0.084sec and hitting the wall atleast three times in the final sector (apex of T15, exit of T19 and the opposite wall on the start-finish-straight.",140,2025-05-22T06:59:46,/r/formula1/comments/1ksovbx/verstappen_v_alonso_at_monaco_q3_2023_sector_of/,Vast-Manufacturer-96,44.0,,,
mtn2opl,,,1,2025-05-22T06:59:48,,AutoModerator,,t3_1ksovbx,t3_1ksovbx,"[The **Technical** flair](https://www.reddit.com/r/formula1/wiki/flairguide#wiki_technical) is used for posts that dive into the technical aspects of Formula 1.

*[Read the rules](https://www.reddit.com/r/formula1/wiki/userguide). Keep it civil and welcoming. Report rulebreaking comments.*

*I am a bot, and this action was performed automatically. Please [contact the moderators of this subreddit](/message/compose/?to=/r/formula1) if you have any questions or concerns.*"
mtn4x3v,,,38,2025-05-22T07:14:36,,Brafo22,,t3_1ksovbx,t3_1ksovbx,"S3 was bad for Aston Martin, they were slow there during the whole weekend if i remember correctly"
mtn4q6i,,,77,2025-05-22T07:13:21,,IHaveADullUsername,,t3_1ksovbx,t3_1ksovbx,"Alonso's Q3 S3 was slowest of pretty much anyone in the top 10, if I recall from the sector times it was slower than some of those who exited in Q2. The Aston was a dog in S3 all weekend. So whilst Verstappen's S3 was unreal to watch, hitting the wall only slows you down. And he hit it 3 times."
mtndqe8,,,18,2025-05-22T08:08:13,,SteelerFever97,,t3_1ksovbx,t3_1ksovbx,People understand that being a tenth up on the 2nd best S3 is still a decently sized gap for the shortest sector of the circuit right lol?
mtnc1ew,,,24,2025-05-22T07:58:23,,PapaSheev7,,t3_1ksovbx,t3_1ksovbx,"It was a very good lap by Verstappen, no doubt, but to call it a sector of the gods is laying it on way too thickly imo. He had a great final sector in comparison to Alonso, but there's two things important to note. One, Alonso had a poor final sector compared to the rest of the field in Q3, he did all his damage in sectors one and two. Two, while Verstappen did well to recover his deficit to Alonso, the next quickest driver was only a tenth slower, and it was Ocon of all people in an Alpine."
mtn4yme,,,21,2025-05-22T07:14:53,,Bart-86,,t3_1ksovbx,t3_1ksovbx,Unpopular opinion but this lap is a bit overrated. It looked better than it was because of the comparison with Alonso who had the slowest sector 3 of all the drivers in Q3.
mtn43hu,,,12,2025-05-22T07:09:15,,Apachee69,,t3_1ksovbx,t3_1ksovbx,"Alonso was poor in the final sector that weekend, it was a great final sector but it’s overblown a bit by Alonso’s relatively poor sector."
mtnyupg,,,1,2025-05-22T09:57:49,,Thejklay,,t3_1ksovbx,t3_1ksovbx,If Alonso put inters on in the race first instead of doing a new set of sticks would he have won?
mtnm1n5,,,1,2025-05-22T08:53:51,,CeilingVitaly,,t3_1ksovbx,t3_1ksovbx,"I present: Schumacher making up 7 tenths in that same sector vs a dominant Williams in 1996

https://youtu.be/7CzQzg28ghU?si=x1CTg8SL4r323c2d"
