id,title,selftext,score,created,permalink,author,num_comments,link_id,parent_id,body
mtn8z8f,,,1,2025-05-22T07:40:12,,AutoModerator,,t3_1kspof9,t3_1kspof9,"[The **Photo** flair](https://www.reddit.com/r/formula1/wiki/flairguide#wiki_photo) is for submissions sharing photos from the world of F1. Photos should be interesting and relevant - random photos not notable enough to warrant a standalone post will be subject to removal. This flair should not be used for images which are not photos, such as screenshots, statistical graphics, or artworks.

*[Read the rules](https://www.reddit.com/r/formula1/wiki/userguide). Keep it civil and welcoming. Report rulebreaking comments.*

*I am a bot, and this action was performed automatically. Please [contact the moderators of this subreddit](/message/compose/?to=/r/formula1) if you have any questions or concerns.*"
mtn9l8f,,,157,2025-05-22T07:43:51,,negotinec,,t3_1kspof9,t3_1kspof9,From the thumbnail it looked like a Verstappen tribute.
mtnal4b,,,113,2025-05-22T07:49:50,,Vegetable-Bee5157,,t3_1kspof9,t3_1kspof9,I would love Ollie to have a teddy bear themed helmet!
mtnav06,,,22,2025-05-22T07:51:29,,Careful-Door2724,,t3_1kspof9,t3_1kspof9,Was there some announced white theme this weekend?
mtnasf3,,,17,2025-05-22T07:51:03,,Key_Proposal_9055,,t3_1kspof9,t3_1kspof9,Looks like a special helmet Charles would use.
mtnp9yp,,,1,2025-05-22T09:10:35,,y4sh-2,,t3_1kspof9,t3_1kspof9,Seems like Bearman mixed Max's and Leclerc's helmets' designs.
mtnaric,,,34,2025-05-22T07:50:55,,Upbeat-Original-7137,,t3_1kspof9,t3_1kspof9,It feels like drivers get a special helmet for every race
mtnb057,,,27,2025-05-22T07:52:20,,DrRevolution,,t3_1kspof9,t3_1kspof9,Could it look any more like Max’s lion…
mtnbue2,,,6,2025-05-22T07:57:14,,Legitimate_Dare_579,,t3_1kspof9,t3_1kspof9,I like it but at the same time if I see this at a random point during the weekend with no name I'll think it's Leclerc. Idk if he had a similar design before.
mtnb5xn,,,3,2025-05-22T07:53:16,,Walaii,,t3_1kspof9,t3_1kspof9,Looks better than his regular helmet imo.
1kss77u,Verstappen now joint 3rd in number of races led from start to finish,,759,2025-05-22T09:31:36,/r/formula1/comments/1kss77u/verstappen_now_joint_3rd_in_number_of_races_led/,Div_K,111.0,,,
mtnti79,,,1,2025-05-22T09:31:39,,AutoModerator,,t3_1kss77u,t3_1kss77u,"[The **Statistics** flair](https://www.reddit.com/r/formula1/wiki/flairguide#wiki_statistics) is reserved for posts highlighting interesting statistics. As a rule of thumb, Statistics posts need to inform readers through visualizations and insights that cannot be obtained from raw data alone. For example, a post containing a qualifying gap between two drivers expressed in tenths of a second is an easily obtainable raw piece of data and constitutes a bad Statistics post. A visualization of what that translates to on-track, or visualization of how that gap came to be would constitute a good Statistics post.

*[Read the rules](https://www.reddit.com/r/formula1/wiki/userguide). Keep it civil and welcoming. Report rulebreaking comments.*

*I am a bot, and this action was performed automatically. Please [contact the moderators of this subreddit](/message/compose/?to=/r/formula1) if you have any questions or concerns.*"
mtntsi3,,,1,2025-05-22T09:33:04,,swannyhypno,,t3_1kss77u,t3_1kss77u,Vettel higher than Schumacher here just looks weird fair play Seb 😂
mtnzc8s,,,1,2025-05-22T10:00:11,,hache-moncour,,t3_1kss77u,t3_1kss77u,"Did a quick filtering to see how different this was over the decades. This is the total number of races where anyone led start-to-finish, without any adjusting for the total number of races per decade:

* 1950-1959: 21
* 1960-1969: 25
* 1970-1979: 39
* 1980-1989: 31
* 1990-1999: 34
* 2000-2009: 16
* 2010-2019: 46
* 2020-2025: 25 (ongoing)

2000-2009 is a clear anomaly, having a pretty high number of races and barely any entries. I doubt it was that much more competitive, more likely rule changes affected it a lot."
mtnv9yb,,,1,2025-05-22T09:40:24,,drh4995,,t3_1kss77u,t3_1kss77u,"The important bit is how many races have they done, no doubt Ascari or Clark would be top based on percentages of races"
mto52cr,,,1,2025-05-22T10:27:53,,tortellinipizza,,t3_1kss77u,t3_1kss77u,"Jim Clark having led almost a fifth of all his races from start to finish, wow. He really was something else in a car"
mto0htv,,,1,2025-05-22T10:05:51,,CcCcCcCc99,,t3_1kss77u,t3_1kss77u,"Clark, Stewart and Ascari's stats are actually quite impressive"
mtny7id,,,1,2025-05-22T09:54:42,,Div_K,,t3_1kss77u,t3_1kss77u,"Current drivers who are in the list beyond the photo:

* Alonso - 3
* Leclerc - 2
* Norris - 2
* Sainz - 1"
mto1pka,,,1,2025-05-22T10:11:43,,Itchbatchi,,t3_1kss77u,t3_1kss77u,It’s crazy still seeing Senna up near the tops of these lists considering the era he raced in.
mtofjij,,,1,2025-05-22T11:18:23,,EddieMcDowall,,t3_1kss77u,t3_1kss77u,"I'm not undermining this in any way, it's a great achievement.

But, I'm interested to hear for this stat how they define 'the start'. Because, if it's 'lights out' then in the last race at Imola, Max didn't lead from the start, he lead from the second corner (great move btw).

Even if someone stalled at the start (not possible nowadays) the pole sitter would always be 'in the lead' for a time. Therefore, unless they define 'the start' differently to achieve a 'lead from start to finish' you must first be on pole.

Or am I missing something?"
mtnw7yc,,,1,2025-05-22T09:45:02,,RodrigoF,,t3_1kss77u,t3_1kss77u,Max was that close to a Grand Slam...Which I really didn't expect to be even within the bounds of imagination this season.
1kt660p,The Championship Battle so far.,,118,2025-05-22T19:17:09,/r/formula1/comments/1kt660p/the_championship_battle_so_far/,TheFlyingR0cket,34.0,,,
mtr1ncl,,,1,2025-05-22T19:17:11,,AutoModerator,,t3_1kt660p,t3_1kt660p,"[The **Statistics** flair](https://www.reddit.com/r/formula1/wiki/flairguide#wiki_statistics) is reserved for posts highlighting interesting statistics. As a rule of thumb, Statistics posts need to inform readers through visualizations and insights that cannot be obtained from raw data alone. For example, a post containing a qualifying gap between two drivers expressed in tenths of a second is an easily obtainable raw piece of data and constitutes a bad Statistics post. A visualization of what that translates to on-track, or visualization of how that gap came to be would constitute a good Statistics post.

*[Read the rules](https://www.reddit.com/r/formula1/wiki/userguide). Keep it civil and welcoming. Report rulebreaking comments.*

*I am a bot, and this action was performed automatically. Please [contact the moderators of this subreddit](/message/compose/?to=/r/formula1) if you have any questions or concerns.*"
mtr34nj,,,1,2025-05-22T19:26:08,,Mael_au,,t3_1kt660p,t3_1kt660p,"I think that demonstrates just how close it will be, crazy winning 4 races to 1 and only being 13 points ahead."
mtr6eke,,,1,2025-05-22T19:45:57,,jules3001,,t3_1kt660p,t3_1kt660p,I’m confused by the races row. 5 and 4? Does that include sprints and it’s like who finished ahead?
mtr7mou,,,1,2025-05-22T19:53:13,,westens,,t3_1kt660p,t3_1kt660p,"Meanwhile, what's that I hear in the background? Du du dudu."
mtr9ghl,,,1,2025-05-22T20:04:04,,Jazib7,,t3_1kt660p,t3_1kt660p,All this only for max to win the championship🙂
mtr3127,,,1,2025-05-22T19:25:32,,Bgndrsn,,t3_1kt660p,t3_1kt660p,"Yikes, I knew Oscar has been the better of the two but not by that much."
mtr1qkc,,,1,2025-05-22T19:17:43,,TheFlyingR0cket,,t3_1kt660p,t3_1kt660p,"Notes.

Wins for races and sprint races are separate.

Races and qualifying include Sprint results.

Races results just means who finished ahead of the other.

If you have any suggestions please put in the comments.

Enjoy Peace."
mtr65a3,,,1,2025-05-22T19:44:25,,chiefzanal,,t3_1kt660p,t3_1kt660p,The only real difference is lando isnt an epic qualifier. He’s only 13 back and has had a terrible start to the year while Oscar has had a great start but yet only 13 ahead. That is the story
mtr32qo,,,1,2025-05-22T19:25:49,,v12vanquish135,,t3_1kt660p,t3_1kt660p,"Oscar really fixed his 23-24 shortcomings, he's very well rounded this year. Lando probably blew last year as his only real shot at the title."
mtrb6fr,,,1,2025-05-22T20:14:23,,Largetaco12,,t3_1kt660p,t3_1kt660p,"I’m interested to see if Norris can get more comfortable in the car. Whole the MCL39’s extreme anti-dive is the key to its success or a partial key, it’s also very much hamstrung Norris in the early season with a major driving style clash. The characteristics have leant more to Piastri’s driving style, that combined with a general improvement in himself he’s taken the initiative."
1ksp29u,"Leclerc: “Negative 2025 balance, we are not happy with the SF-25. But from Barcelona…”",,803,2025-05-22T07:09:28,/r/formula1/comments/1ksp29u/leclerc_negative_2025_balance_we_are_not_happy/,doublejohnnie,96.0,,,
mtn44no,,,1,2025-05-22T07:09:28,,AutoModerator,,t3_1ksp29u,t3_1ksp29u,"[The **News** flair](https://www.reddit.com/r/formula1/wiki/flairguide#wiki_news) is reserved for submissions covering F1 and F1-related news. These posts must always link to an outlet/news agency, the website of the involved party (i.e. the McLaren website if McLaren makes an announcement), or a tweet by a news agency, journalist or one of the involved parties.

*[Read the rules](https://www.reddit.com/r/formula1/wiki/userguide). Keep it civil and welcoming. Report rulebreaking comments.*

*I am a bot, and this action was performed automatically. Please [contact the moderators of this subreddit](/message/compose/?to=/r/formula1) if you have any questions or concerns.*"
mtn4rvn,,,796,2025-05-22T07:13:39,,Landlubber77,,t3_1ksp29u,t3_1ksp29u,"> For several Grands Prix, our weak points have been the slow corners . Unfortunately, in Monaco, there is only this type of corner, so I expect a complicated weekend . At the same time, the circuit is so special and unique that we can hope that there is something in the car that we have not yet discovered and that will reveal itself here.

Official Ferrari strategy: hoping that the car will reveal itself because the circuit is unique and special. Woof."
mtn4i21,,,57,2025-05-22T07:11:53,,doublejohnnie,,t3_1ksp29u,t3_1ksp29u,"Translation 


On the eve of his home race, Charles Leclerc met with the Monegasque press, drawing up a very honest assessment of his 2025. The Ferrari driver did not hide his disappointment for the poor results obtained in the first seven events of the year, in which he collected only 61 points and a podium in the Jeddah race .



Leclerc: “We are not satisfied with the car”


Ferrari had closed 2024 by challenging McLaren for the Constructors' title until the final corners of the last Grand Prix of the year. The great design revolution involving the SF-25 should have allowed it to take that further step forward that the 2024 single-seater, now at the maximum of its development, would not have been able to guarantee.


So, at least for now, it has not been and from this point Leclerc's judgment on the current season starts: "" Clearly, it is negative . We are not at all satisfied with the performance of the car. Last year we ended the season fighting for the Constructors' World Championship. So we had a lot of ambition to try to win the title this year . We are fully committed to trying to recover the performance lost compared to McLaren and Red Bull in particular .""


The winter objective now seems compromised, considering the big gap in the general classification accumulated in these first months. On the horizon, however, is the Spanish GP, an event that could bring a small revolution in the values on the track: “ It is simply impossible for me to say that a good season would mean finishing fourth, third, etc. Honestly, I will believe it until the end ,” said Leclerc. “ Last year, we had an ultra-dominant Red Bull in the first seven races, and then a McLaren that recovered strongly. I hope we can have this kind of turnaround starting from Barcelona. In Spain, there will be a change to the technical regulation for the wings , which we have worked a lot on. It should be an advantage for us , but it remains uncertain. So we must win all the points possible until Barcelona .”


Monte Carlo: an encore is difficult, but…


While waiting for the possible breakthrough in Barcelona, there is the most expensive race for Leclerc to face. The Ferrari driver finally broke his personal curse last year, obtaining his first success on the streets of Monte Carlo.


A repeat this year seems very difficult, even if Leclerc leaves a small hope open: “ I am only aiming for the win. The podium is not something I particularly dream of. For several Grands Prix, our weak points have been the slow corners . Unfortunately, in Monaco, there is only this type of corner, so I expect a complicated weekend . At the same time, the circuit is so special and unique that we can hope that there is something in the car that we have not yet discovered and that will reveal itself here .”


Hamilton's Arrival: A Learning Opportunity


The big theme of the winter was the arrival in Maranello of Lewis Hamilton. The relationship with the seven-time world champion is very good and Leclerc remains convinced that the hiring of a driver with the experience of the British driver has been positive for him too: “ For me, nothing changes. It's a huge learning opportunity for me, because he's one of the legends of F1. But it's also a great motivation and an opportunity to show what I can do with Lewis at my side in the same car .”


Interesting is what Leclerc said about Hamilton’s characteristics from which he has learned the most so far: “ The discipline and his work ethic. Carlos (Sainz) was also a hard worker, but Lewis is a hard worker in a different way , and it’s really interesting to see the dynamics within the team. How does he handle problems? How does he comment on the car during development? It’s always interesting for every driver to be able to analyse how their teammate collaborates with their engineers .”


Among the positive aspects of working with Hamilton, Leclerc also mentioned the driving style: “ He is extremely talented, he has a very interesting driving style, which I can use myself in certain moments of the race , when it is the right time. We drive quite similarly. We both push on the corner entry. I think it is also quite positive for the team, because we have a clear and precise direction, towards which we are both aiming .”"
mtn4iu6,,,196,2025-05-22T07:12:02,,Former-Avocado-1974,,t3_1ksp29u,t3_1ksp29u,Next Race
mtn5hr6,,,108,2025-05-22T07:18:20,,LYuen,,t3_1ksp29u,t3_1ksp29u,The car is slow now but from Barcelona it will become undrivable 
mtn4n4f,,,77,2025-05-22T07:12:47,,Lentemern,,t3_1ksp29u,t3_1ksp29u,"We've gone from ""next year"" to ""next race"""
mtn4ojs,,,29,2025-05-22T07:13:03,,markusfenix75,,t3_1ksp29u,t3_1ksp29u,"Obligatory ""don't give me hope"""
mtn6f37,,,24,2025-05-22T07:24:19,,Hag_bolder,,t3_1ksp29u,t3_1ksp29u,A few weeks ago it was from imola
mtn4sxm,,,22,2025-05-22T07:13:50,,Sofosio,,t3_1ksp29u,t3_1ksp29u,"…nothing will change” Unless they pull a McLaren and the season suddenly shifts to an even crazier outcome, with McLaren vs. Max vs. Ferrari"
mtn9yfh,,,7,2025-05-22T07:46:02,,chinny18,,t3_1ksp29u,t3_1ksp29u,(insert hopium here)
1ksvgsl,[Scuderia Ferrari via ig] Innovation from day one. 75 years with Shell,ngl seeing the number 75 on the Ferrari reminds me of F1-75 from 2022,302,2025-05-22T11:43:38,/r/formula1/comments/1ksvgsl/scuderia_ferrari_via_ig_innovation_from_day_one/,NegotiationNew9264,32.0,,,
mtolq1e,,,1,2025-05-22T11:48:30,,city-of-cold,,t3_1ksvgsl,t3_1ksvgsl,This has to be the longest running sponsorship in all of sports?
mtoovj2,,,1,2025-05-22T12:03:22,,eszgbr,,t3_1ksvgsl,t3_1ksvgsl,They used Agip from 1974 to 1995.
mtovmod,,,1,2025-05-22T12:34:53,,salcedoge,,t3_1ksvgsl,t3_1ksvgsl,Shells logo has aged insanely well compared to other companies
mtolvdg,,,1,2025-05-22T11:49:11,,,,t3_1ksvgsl,t3_1ksvgsl,[deleted]
mtoscfr,,,1,2025-05-22T12:19:41,,KingMaple,,t3_1ksvgsl,t3_1ksvgsl,Shouldn't HP logo be on top of Shell?
mtonthr,,,1,2025-05-22T11:58:15,,squaler24,,t3_1ksvgsl,t3_1ksvgsl,"Everything you got, Throw it at qualifying for a good grid.

Race pace at Monaco matters for little."
mtopqmv,,,1,2025-05-22T12:07:30,,NLDutchie,,t3_1ksvgsl,t3_1ksvgsl,"So Shell was still sponsoring Ferrari while AGIP was also sponsoring Ferrari and being shown on the car?

[https://cdn.shopify.com/s/files/1/0035/9877/8435/files/1980\_US\_West\_Grand\_Prix\_Gilles\_Villeneuve\_Ferrari\_2048x2048.jpg](https://cdn.shopify.com/s/files/1/0035/9877/8435/files/1980_US_West_Grand_Prix_Gilles_Villeneuve_Ferrari_2048x2048.jpg)"
mtomad6,,,1,2025-05-22T11:51:09,,DragonBeyondtheWall,,t3_1ksvgsl,t3_1ksvgsl,"Wait, so they have been together since the inception of Ferrari?"
mtomgzv,,,1,2025-05-22T11:52:01,,steferrari,,t3_1ksvgsl,t3_1ksvgsl,Hopefully it surprisingly gives the car F1-75 pace. 😄
mtoq9p8,,,1,2025-05-22T12:10:00,,Abdullah-Alturki,,t3_1ksvgsl,t3_1ksvgsl,"""vai de shell v power"""
1kt20zx,"Brazil media question : ""Max u seems a lot help Gabriel like a young brother for you and we also in Brazil said there a bit of a romance between you two"" .. (max start joking with Gabi).....",,116,2025-05-22T16:07:40,/r/formula1/comments/1kt20zx/brazil_media_question_max_u_seems_a_lot_help/,Luffy710j,17.0,,,
mtqdscc,,,1,2025-05-22T17:01:15,,Portocala69,,t3_1kt20zx,t3_1kt20zx,The title gave me a stroke.
mtq6376,,,1,2025-05-22T16:20:01,,Prince-ess_-_,,t3_1kt20zx,t3_1kt20zx,r/FanF1ction will get a hold of this
mtq4x1k,,,1,2025-05-22T16:13:59,,D4rth4venger,,t3_1kt20zx,t3_1kt20zx,Max his family is expanding rapidly.
mtqi4to,,,1,2025-05-22T17:25:17,,queerhedgehog,,t3_1kt20zx,t3_1kt20zx,"Their relationship is so cute! Max has been a friend and advisor for Gabi for a while. 

>”Max is a good friend of mine. I really consider him a good friend. He’s been helping me a lot in the background, a lot of people don’t know. When I was in F3 was the moment I think we started getting a bit closer. We do a lot of simulator together. He advices me to do the best I can in this championship. ‘Make sure you finish the races, make sure you do well in this championship.’ He’s still helping me a lot, with my future.”

>”I helped Gabi with certain decisions in his career. He asked me for advice like ‘what would you do?’ or ‘what should I sign?’ You have a honest conversation about it and ultimately I told him: ‘the most important thing you got to do is step on the gas, then everyone will approach you.’”"
mtr2245,,,1,2025-05-22T19:19:40,,TheDevilsDingo,,t3_1kt20zx,t3_1kt20zx,Holy English batman
mtqawku,,,1,2025-05-22T16:46:01,,laboulaye22,,t3_1kt20zx,t3_1kt20zx,"Some of these questions, man..."
mtr4jnj,,,1,2025-05-22T19:34:45,,Misfit_Cookie_423,,t3_1kt20zx,t3_1kt20zx,"They’re back to walking on egg shells again with him. The questions are always boring to all the drivers but they give him soft questions because they’re all nervous know and it’s obvious, as are the cheeky responses. I mean, what’s the point with these things anymore? 

Information gleaned is essentially none. Alex gives thoughtful answers. Pierre. The ones who don’t get asked much I guess. Maybe they should reduce the number of interviews and it might be more interesting."
mtqr9ah,,,1,2025-05-22T18:16:42,,Successful_Yellow285,,t3_1kt20zx,t1_mtqi4to,"I'm sure Max has been tremendously helpful but those examples are hilarious


> Make sure you finish the races, make sure you do well in this championship


Git gud, vroom fast, do well. That's some Korean esports advice right there :D"
mtqhrjg,,,1,2025-05-22T17:23:12,,Rinaldootje,,t3_1kt20zx,t1_mtqawku,"better question than the same question you get every week. 

Getting a silly question at least gets the better and more genuine responses. Besides the standard ""Yes everyone at <team name> is in it together and will do their upmost best to have a good weekend here at a great track like <track name>. And we hope the upgrade package from everyone at the factory will help us get closer to/stay ahead of <rival team name>. """
mtqd566,,,1,2025-05-22T16:57:50,,curtains_inblue,,t3_1kt20zx,t1_mtqawku,"they are fun, sometimes you needa break from the same will the car click tomorrow qns"
1ks7mol,[F1] Our drivers got to enjoy a private screening of F1 Movie in Monaco!,,14728,2025-05-21T15:04:28,/r/formula1/comments/1ks7mol/f1_our_drivers_got_to_enjoy_a_private_screening/,LC1597,1000.0,,,
mtj8mqo,,,7248,2025-05-21T15:10:03,,Aromatic_Fail_1722,,t3_1ks7mol,t3_1ks7mol,Dads wearing casual attire while taking the kids to the movies.
mtj82cl,,,3425,2025-05-21T15:07:20,,garethchester,,t3_1ks7mol,t3_1ks7mol,Why does Charles already look like he's been left put on slicks too long
mtj95r3,,,1479,2025-05-21T15:12:35,,wokwok__,,t3_1ks7mol,t3_1ks7mol,The hell did they do to George's hand lmao half of it is split in half
mtj8mvw,,,1292,2025-05-21T15:10:04,,powahless,,t3_1ks7mol,t3_1ks7mol,Alonso looks like the dad who reluctantly took his kids to watch a movie they wanted to watch.
mtj86lx,,,2021,2025-05-21T15:07:54,,CilanEAmber,,t3_1ks7mol,t3_1ks7mol,"Hamilton and Alonso with the privilege of not having to wear team clothing.

E: Leclerc too, didn't see him back there.

E2: Where Stroll? Hanging with Verstappen?

E3: That second question is a joke, so people stop explaining to me the obvious."
mtj8n73,,,487,2025-05-21T15:10:07,,M1st3rv,,t3_1ks7mol,t3_1ks7mol,"They all look like they are posing for a proof of life picture, it's just missing someone holding todays paper."
mtj9x66,,,568,2025-05-21T15:16:14,,ClintBIgwood,,t3_1ks7mol,t3_1ks7mol,That light ain’t doing Lewis forehead any favours. 😂
mtj9yby,,,154,2025-05-21T15:16:22,,TimmyHate,,t3_1ks7mol,t3_1ks7mol,"Guessing Liam and Fernando buried the hatchet

Edit: although it does look like Liam is about to pull the ol yawn/arm around trick on Alex"
mtjbe1f,,,95,2025-05-21T15:23:01,,hauntedSquirrel99,,t3_1ks7mol,t3_1ks7mol,"But seriously, why do half of them look like they're reading a ransom note in a proof of life video?"
mtj7x20,,,1444,2025-05-21T15:06:37,,maestro826,,t3_1ks7mol,t3_1ks7mol,except Max who decided to game instead lol
1ksu7es,"What’s a Mario Kart track that you think could work great for F1, either as it is or with a few adjustments?","One of my favourite tracks across the series is Mario Circuit from Double Dash and I think it could work kind of well for F1 with a good length put and back straight which could make for good DRS zones, it’s got some good elevation changes which I think would be fun to drive in a Formula car - the only thing I would change is to remove the mounds just after Turn-8, and obviously remove the chain chomp from the Turn-3 area. But overall, layout wise I think it could be fun to see racing here

Daisy Circuit from Wii is another circuit I’d find interesting in F1 - I would change the overlapping roundabouts to be more like Maggots & Beckets or the Suzuka Esses - it could also work with a complete straight and make that a DRS zone to add one other than the pit straight. It does also have the straight-hairpin-straight complex that Hanoi would have had and I think Sector 1 is an interesting sort of Monaco-esque feel to it

Also shoutout to Royal Raceway from N64 as that’s basically Silverstone mixed with Suzuka - remove the gap jump and make that a DRS straight and we’re golden to make it an F1 track",194,2025-05-22T10:53:28,/r/formula1/comments/1ksu7es/whats_a_mario_kart_track_that_you_think_could/,tm2007,117.0,,,
mtoagcr,,,1,2025-05-22T10:53:29,,AutoModerator,,t3_1ksu7es,t3_1ksu7es,"[The **Off-Topic** flair](https://www.reddit.com/r/formula1/wiki/flairguide#wiki_off-topic) is for submissions only tangentially related to Formula 1 or submissions pertaining to the wider world of motorsport.

This flair is not a free pass for content unsuitable for r/Formula1 or the r/Formula1 community. Posts that are deemed too far off-topic, irrelevant, or inappropriate will be removed at the discretion of the moderators.

*[Read the rules](https://www.reddit.com/r/formula1/wiki/userguide). Keep it civil and welcoming. Report rulebreaking comments.*

*I am a bot, and this action was performed automatically. Please [contact the moderators of this subreddit](/message/compose/?to=/r/formula1) if you have any questions or concerns.*"
mtoat7e,,,1,2025-05-22T10:55:11,,CilanEAmber,,t3_1ksu7es,t3_1ksu7es,Yoshis Circuit GCN.
mtoc3tg,,,1,2025-05-22T11:01:27,,mau5gaming,,t3_1ksu7es,t3_1ksu7es,Baby park!
mtocmg9,,,1,2025-05-22T11:04:00,,Eroda,,t3_1ksu7es,t3_1ksu7es,We all know it's rainbow road.
mtodgl0,,,1,2025-05-22T11:08:10,,Bill_MF_Bradley,,t3_1ksu7es,t3_1ksu7es,"Came here expecting to see Rainbow Road and was not disappointed

Honorable mention to that DK track with the barrel cannon"
mtobn1l,,,1,2025-05-22T10:59:09,,Total-Collection-128,,t3_1ksu7es,t3_1ksu7es,Wasn't the second one meant to be the Vietnam Grand Prix?
mtogioo,,,1,2025-05-22T11:23:08,,Top-Competition9263,,t3_1ksu7es,t3_1ksu7es,I think any current track could be made more fun with a few strategically placed Thwomps.
mtocj5k,,,1,2025-05-22T11:03:33,,snoopdoge90,,t3_1ksu7es,t3_1ksu7es,"Mario Circuit, the Mobius racing track. F1 should put their money where their mouth is. Long enough they've told us a F1 car can drive upside down because they generate enough downforce. I believe it when I see it"
mtogki0,,,1,2025-05-22T11:23:23,,sofawood,,t3_1ksu7es,t3_1ksu7es,Moo Moo Farm 64
mtoc52p,,,1,2025-05-22T11:01:37,,Driscuits,,t3_1ksu7es,t3_1ksu7es,N64 Royal raceway - but keep the jump haha.
