id,title,selftext,score,created,permalink,author,num_comments,link_id,parent_id,body
1kq8v7a,2025 Emilia-Romagna GP - Day After Debrief,"Welcome to the Day after Debrief discussion thread!

Now that the dust has settled in Imola, it's time to calmly discuss the events of the last race weekend. Hopefully, this will foster more detailed and thoughtful discussion than the immediate post-race thread now that people have had some time to digest and analyze the results.

Low-effort comments, such as memes, jokes, and complaints about broadcasters will be deleted. We also discourage superficial comments that contain no analysis or reasoning in this thread (e.g., 'Great race from X!', 'Another terrible weekend for Y!').

Thanks",67,2025-05-19T06:02:48,/r/formula1/comments/1kq8v7a/2025_emiliaromagna_gp_day_after_debrief/,AutoModerator,283.0,,,
mt45vdg,,,76,2025-05-19T08:03:39,,yosoygroot123,,t3_1kq8v7a,t3_1kq8v7a,"
McLaren did the right call to let Piastri and Norris fight at the end. They would have lost the time while swapping anyway and Lando wouldn't have catched Max. It was like Suzuka. They are consistent with their papaya rules."
mt7psvq,,,67,2025-05-19T19:08:39,,Billy_Butcher_xl,,t3_1kq8v7a,t3_1kq8v7a,"It was a good race on a real race track, i dont get the complaints tbh"
mt4aupl,,,49,2025-05-19T08:33:36,,A___99,,t3_1kq8v7a,t3_1kq8v7a,"Leclercs early stop triggered a chain reaction that tricked so many into an early pitstop. I'm not sure why Sainz went so early. 


The Aston's and Russell would have needed to pit slightly earlier but not that much. Russell's tyres probably would have recovered a bit after the pace slowed once he wasn't pushing so hard to keep Norris behind. Alonso was reacting to Sainz, which is a bit unlike them as they usually go a bit longer. Stroll I have no idea what the plan was.


To me it seemed like McLaren thought they would need to try something different to beat Max, and the Leclerc undercut forced them to make a quick choice. They probably should have taken the safe option and let Piastri fall off the back of Verstappen and settle for a 2 3. Pitting behind so many cars you would need to overtake guarantees the same result at best but with a lot lot more risk. Seemed unnecessary"
mt5qruc,,,38,2025-05-19T12:54:30,,Starboard-Port,,t3_1kq8v7a,t3_1kq8v7a,"Outside of the 1st turn move, I've been thinking a lot about Max's 1st and 3rd stints. He pulled a decent 2-3 second gap on Oscar in the first 15 laps, and the RB's tyres and relative lap times held on much longer than the projected pit window. He certainly got fortunate with VSC, but the damage appeared to be already done. Then on the third stint, he pulled a 5-6 gap to finish the race, certainly aided by the tyre offset to Lando and Oscar, but that's a relatively large gap in 10 laps. Will be interested to see how the car performs on a normal race track (not Manaco) in dirty air and whether it'll be able to keep up with McLaren. I hope we have a true 3-way championship battle on our hands."
mt3u0cr,,,73,2025-05-19T06:44:09,,icecreamperson9,,t3_1kq8v7a,t3_1kq8v7a,"i can’t believe how entertaining the race actually was compared to previous years.. the softer tyres added strategy options and SC in the last ten laps was fun..

Max’s move was awesome i didn’t even see it coming until he already almost passed oscar. i really hope rbr actually made a huge step forward so that we can have a proper 3 way fight"
mt6mwy6,,,22,2025-05-19T15:33:40,,Background-Main-7427,,t3_1kq8v7a,t3_1kq8v7a,"I think it was a very interesting race with several good passes in a circuit that did not favor it, but isn't at Monaco levels of not favoring it."
mt3tlua,,,42,2025-05-19T06:41:10,,Nehaline,,t3_1kq8v7a,t3_1kq8v7a,"That's that for Imola, at least for the forseeable future. Ended on a high.

I'm going to miss it. Yes, it's too narrow, and there's only one real overtaking spot, and the pitlane is way too long. But it's a great flowing track in a lovely setting, and the fans are always excellent. 

Can't wait to find out which petrodome or street circuit will replace it. If we got Istanbul back, it wouldn't be so bad."
mt3yi0h,,,29,2025-05-19T07:16:11,,ghastlychild,,t3_1kq8v7a,t3_1kq8v7a,"I am going to go out on a limb and predict that some people here, in the future, will forget the importance of luck in races. You can absolutely put everything together but luck also has a small part to play in how your race is going to go. It is what I thought of when I thought about some of the drivers that got their opportunities squandered after the VSC, particularly Sainz

Williams is on a roll! Strong as hell qualifying and a formidable race. A lot could have gone differently, most notably Sainz pitting right before the VSC was thrown into the mix. But it is a good thing he managed to recover it fairly well, with the pace that he had. Albon himself had a strong race as well. Minus the incident with Leclerc and being caught in dirty air, I think there was a real possibility of him ending up in podium places. From an overview glance, this team in this season is such an improvement over the last, and years that followed. What JV has managed to do with the team is commendable, with two drivers that are able to challenge each other and a group of trustworthy personnel back in Grove to get the job done, they are ending their weekends on a solid and maximising on what they can *(all without upgrades considering development is going towards the FW48 but if the FW47's performance window maintains and they can keep themselves ahead, then hell yeah)*

Onward to the next few races! These results show promise and I am thrilled to see what else they have in store"
mt4u35h,,,28,2025-05-19T10:14:35,,csRemoteThrowAway,,t3_1kq8v7a,t3_1kq8v7a,Whatever Red Bull did the pace they had this race was much improved. The Max overtake was just nuts. Seems like Max still in the hunt. Glad Yuki got into the points. Overall great race.
mt47pj1,,,11,2025-05-19T08:14:55,,Poh-taytoes,,t3_1kq8v7a,t3_1kq8v7a,"Did Sky ever show the bit they filmed with Antonelli showing Ted Kravitz around Bologna?

They advertised it all weeked long, and kept saying ""coming up after the break"" on Sunday but it never appeared.  Did they ever show it at all?  It doesn't seem to be on their youtube channel either!"
1ksjj8z,Ask r/Formula1 Anything - Daily Discussion Thread,"# Welcome to the [r/formula1](https://www.reddit.com/r/formula1/) Daily Discussion / Q&A thread.

This thread is a hub for general discussion and questions about Formula 1, that don't need threads of their own.

Are you new to Formula 1? This is the place for you. Ever wondered why it's called a lollipop man? Why the cars don't refuel during pitstops? Or when Mika will be back from his sabbatical? Ask any question you might have here, and the community will answer.

Also make sure you check out our [guide for new fans](https://www.reddit.com/r/formula1/wiki/newtof1), and our [FAQ for new fans](https://www.reddit.com/r/formula1/wiki/faq).

Are you a veteran fan, longing for the days of lollipop men, refueling during pitstops, and Mika Häkkinen? This is the place to introduce new fans to your passion and knowledge of the sport.

Remember to keep it civil and welcoming! Gatekeeping within the Daily Discussion will subject users to disciplinary action.

Have a meta question about the subreddit? Please [direct these to the moderators](https://www.reddit.com/message/compose/?to=/r/formula1) instead.",9,2025-05-22T01:01:09,/r/formula1/comments/1ksjj8z/ask_rformula1_anything_daily_discussion_thread/,F1-Bot,94.0,,,
mtm0bhk,,,10,2025-05-22T01:07:19,,PassTimeActivity,,t3_1ksjj8z,t3_1ksjj8z,">He's 43 going on 44, and the Asturian remains the driver on the grid with the best starts. He averages a 2.86-second reaction time (from 0 to 100 kilometers per hour) in dry starts , and no other driver on the grid is on par with him. Esteban Ocon (2.95), Alex Albon (2.96), George Russell (2.96), and Lando Norris (2.98) are in the same second.

Unc still got it"
mtm1vea,,,6,2025-05-22T01:21:51,,Auelogic,,t3_1ksjj8z,t3_1ksjj8z,"Anyone foresee any rookies crashing? Tight track, bigger cars and faster speed compared to their F2 cars."
mtm12ci,,,5,2025-05-22T01:14:16,,bwoahful___,,t3_1ksjj8z,t3_1ksjj8z,"How much do ppl think the new Monaco pit stop requirement will help? Generally pit stop strategy is the most interesting part of Sunday, so are hopes high for a more interesting race?"
mtmjy6x,,,3,2025-05-22T04:24:39,,GeologistNo3726,,t3_1ksjj8z,t3_1ksjj8z,How good do you think Williams and Benetton were in 1990? With a better driver lineup do you think they could have challenged for more wins or maybe even a title?
mtp7nur,,,1,2025-05-22T13:31:59,,masculineohioguy,,t3_1ksjj8z,t3_1ksjj8z,"I would love to see the fastest lap point return, but given to the drivers out of the points.  It will give the lower teams something to shoot for every race."
mtm6nhb,,,3,2025-05-22T02:07:41,,denbommer,,t3_1ksjj8z,t3_1ksjj8z,"With the discussions flaring up again around the Monaco circuit,

what could be done to promote overtaking in Monaco?

I sometimes read about making the cars smaller, but wouldn’t we then have to go back to the size from the 60s or 80s? That seems impossible to me. If we could shrink the cars down to F2 size, that would already make a big difference, I think."
mtn6mm3,,,3,2025-05-22T07:25:39,,dl064,,t3_1ksjj8z,t3_1ksjj8z,"Be a fun post to discuss which famous strategy masterclasses were actually 'we figured fuck it, might as well' from a position of having little to lose. 

So Schumacher France 2004, even really Schumacher Hungary 1998. They were fun ideas and paid off, but if they'd *not* they'd still be 3rd at worse. 

Perez at Monaco 2022 another one; gets credit for winning but *really* he was just 4th and therefore the obvious one to take a chance."
mtnj7iz,,,1,2025-05-22T08:38:45,,Gaius_Octavius_,,t3_1ksjj8z,t3_1ksjj8z,What are the mini sectors for the first 7 races that have the most slow speed corners that are somewhat comparable with Monaco?
mtq4gs4,,,1,2025-05-22T16:11:42,,Cody667,,t3_1ksjj8z,t3_1ksjj8z,"I'm trying to think through how the forced 2 stop will work this weekend, knowing that the teams apparently all have substantially different ideas.
The only certainty I can think of is that after qualifying every team is gonna have to mandate a #1 and a #2 driver to make pit windows work and to not lose track position.

The McLaren conversation is gonna be an uncomfortable one particularly if they manage a front row lockout.

If I'm McLaren and I get a front row lockout, I'm having my P2 driver immediately drop back and open a 21 second gap (or w/e the pit stop gap is) so that my P1 driver can pit, then I'm swapping positions and having my driver that just pit slow everyone up to open a 21 second gap again so that the other car can pit, then repeat on the second set of pitstops but in the other driver order (because if you've followed so far, the driver who was in P1 after T1 is now in P2 and the other car is leading) to reestablish the turn one order. Then they can race. I'd ideally want both stops done by lap 40"
mtr68i5,,,1,2025-05-22T19:44:57,,hello61_,,t3_1ksjj8z,t3_1ksjj8z,"Can anyone recommend some good books? Just reading Adrian Newey’s book and really enjoying it.

New-ish F1 fan who has come from watching DTS in 2021-2023 (I love it tho, its my real housewives of f1 and will hear no slander against it), to watching the actual races from 2024. Keen to keep building my knowledge but nothing super technical."
1ksynp4,"[SkySports] George Russell reflects on Max Verstappen's overtake on Oscar Piastri: ""Overtake of the year – definitely! Without doubt. It's the best overtake I've seen in a hell of a long time.""","People on the desktop, right click on the video and click ""show all controls"" ",10327,2025-05-22T13:51:31,/r/formula1/comments/1ksynp4/skysports_george_russell_reflects_on_max/,marypsm,297.0,,,
mtpc3qh,,,1,2025-05-22T13:53:26,,kh493shb47r4,,t3_1ksynp4,t3_1ksynp4,Class response from Russell acknowledging one of his peers skills.
mtpcut0,,,1,2025-05-22T13:57:02,,queerhedgehog,,t3_1ksynp4,t3_1ksynp4,"Nice to hear the respect and praise from George! Such an incredible move. 

Here’s Max’s reaction, he even impressed himself. 

>”When I got home after the race on sunday, I watched it again. When I went through the next corner, I had to laugh. ‘That was good', I thought.”

>”If you look back, you can see that [Oscar] was very concerned with Russell, because he was actually second. So he didn't expect it. I totally understand that. And I took the momentum with me from the outside. Then you can't react anymore.”"
mtpd8xh,,,1,2025-05-22T13:58:55,,P_ZERO_,,t3_1ksynp4,t3_1ksynp4,"Been seeing the online narrative shift on this to “it wasn’t actually that great”. If Russell is saying this, it was quite obviously special.

Presumably people got sick of the praise and wanted to have a contrarian view. Seen some things like “after seeing it for the last few days I don’t think it was that good anymore”. 

Hats off to George, he didn’t have to say those words. My respect only continues to grow for him."
mtpebm2,,,1,2025-05-22T14:04:08,,Not_enough_yuri,,t3_1ksynp4,t3_1ksynp4,"Sort of funny to see him reflect on this moment after the fact. In the car when he saw Max going around the outside he was a bit miffed on the radio, ""wtf was Piastri doing,"" the works. But now he's like ""and then I saw him go around the outside and I was like 'bugger...' Just another example of how it really does feel different when you're in the car."
mtphies,,,1,2025-05-22T14:19:40,,Ainolukos,,t3_1ksynp4,t3_1ksynp4,I love moments like this where game truly recognizes game and drivers can only acknowledge how good one of their competitors is. Great sportsmanship.
mtpccr2,,,1,2025-05-22T13:54:38,,Wimpykid2302,,t3_1ksynp4,t3_1ksynp4,"Alright Russell, I wasn't familiar with your game. Respectable"
mtpid3c,,,1,2025-05-22T14:23:51,,Agent_Boomhauer,,t3_1ksynp4,t3_1ksynp4,You guys ever notice how George always tosses the microphone back and forth during interviews like he’s getting ready to make a pizza?
mtpc847,,,1,2025-05-22T13:54:01,,chaudfontaine10,,t3_1ksynp4,t3_1ksynp4,Class act
mtpcbzc,,,1,2025-05-22T13:54:32,,Basal666,,t3_1ksynp4,t3_1ksynp4,"High praise from George, doubt they ever will be friends but glad to see the respect"
mtphh19,,,1,2025-05-22T14:19:29,,SaturnVFan,,t3_1ksynp4,t3_1ksynp4,Ok Russell has had his moments with Max but this is a class act.
1ksqz1s,[Autosport] Max Verstappen on skipping the F1 movie screening,,24471,2025-05-22T08:40:11,/r/formula1/comments/1ksqz1s/autosport_max_verstappen_on_skipping_the_f1_movie/,RayTracerX,1094.0,,,
mtnlfjr,,,1,2025-05-22T08:50:36,,MPmad,,t3_1ksqz1s,t3_1ksqz1s,The other drivers: 'it wasn't mandatory?!'
mtnjsxk,,,1,2025-05-22T08:41:57,,Actual-Carpenter-90,,t3_1ksqz1s,t3_1ksqz1s,"Btw, he has a brand new baby at home"
mtnkwc5,,,1,2025-05-22T08:47:47,,willfla29,,t3_1ksqz1s,t3_1ksqz1s,"So Sainz says it's not made for F1 fans, Antonelli says it's too long, and Max didn't think it was worth seeing.  Not creating the buzz they wanted haha."
mtnjzxb,,,1,2025-05-22T08:42:59,,rs6677,,t3_1ksqz1s,t3_1ksqz1s,Dude has a kid to raise and sim races to win. Of course he's gonna take all the time he can get.
mtnooqc,,,1,2025-05-22T09:07:36,,killermicrobe,,t3_1ksqz1s,t3_1ksqz1s,"I hate how every single thing in F1 is news, its like watching the Kardashians."
mtnkosp,,,1,2025-05-22T08:46:40,,Ganjagod420,,t3_1ksqz1s,t3_1ksqz1s,"Totally fair, in the middle of a triple header with a new child at home I wouldn't wanna waste time either."
mtnkjjr,,,1,2025-05-22T08:45:53,,,,t3_1ksqz1s,t3_1ksqz1s,[deleted]
mto2urw,,,1,2025-05-22T10:17:16,,SpecificHand,,t3_1ksqz1s,t3_1ksqz1s,"Sorry for my ignorance, but is this actually upsetting to people? I can't fathom putting a single thought into an f1 driver not going to the movies, lol."
mtnju0k,,,1,2025-05-22T08:42:06,,Then_Huckleberry_623,,t3_1ksqz1s,t3_1ksqz1s,"Finally, I can proudly say I have ONE thing in common with Max Verstappen."
mtnustw,,,1,2025-05-22T09:38:04,,DanielOakfield,,t3_1ksqz1s,t3_1ksqz1s,"Max is possibly the most logical human on the grid, he’s also a father now, his private time is up to him how to spend it."
1ksts7n,"[wearetherace] Charles Leclerc being told there’s actually 78 laps of the Monaco GP, not 50",,5631,2025-05-22T10:36:30,/r/formula1/comments/1ksts7n/wearetherace_charles_leclerc_being_told_theres/,DubiousLLM,150.0,,,
mto77mv,,,1,2025-05-22T10:38:07,,P_ZERO_,,t3_1ksts7n,t3_1ksts7n,"Don’t worry Chuck, it’s the shortest distance on the calendar"
mto7se6,,,1,2025-05-22T10:40:50,,JKlerk,,t3_1ksts7n,t3_1ksts7n,At least the post-race travel time home is relatively short.
mto7dhu,,,1,2025-05-22T10:38:53,,NotAcvp3lla,,t3_1ksts7n,t3_1ksts7n,"It's not the result but the expectation which kills you. I see Charles is already prepared for the worst, not a bad mentality to have as a Ferrari driver."
mto9s1z,,,1,2025-05-22T10:50:14,,Harkoncito,,t3_1ksts7n,t3_1ksts7n,"tbf, you don't need pace in Monaco. But you need a fast car for qualy and Ferrari doesn't have that either."
mto94uk,,,1,2025-05-22T10:47:11,,FeverTreeCloud,,t3_1ksts7n,t3_1ksts7n,"Hopefully, two pit stop requirements will make the race more interesting"
mtojixj,,,1,2025-05-22T11:37:57,,TheCatterson,,t3_1ksts7n,t3_1ksts7n,I'm just going to rewatch the 2024 race and pretend it's the 2025 race
mto930p,,,1,2025-05-22T10:46:56,,TheCoolBlondeGirl,,t3_1ksts7n,t3_1ksts7n,Damn I was prepared to leave a funny image on the comments and then I realized we can’t do that anymore 😔
mtoez5b,,,1,2025-05-22T11:15:37,,standupforthechamp,,t3_1ksts7n,t3_1ksts7n,"If by any chance Leclerc has to retire the car this weekend , then he needs to recreate the iconic Kimi walk all the way to a yacht. Man's given up on the Ferrari."
mto9ojt,,,1,2025-05-22T10:49:46,,untouch10,,t3_1ksts7n,t3_1ksts7n,He sufferd so much he is used to it and laugh about it
mtob02j,,,1,2025-05-22T10:56:06,,pemboo,,t3_1ksts7n,t3_1ksts7n,I might put a bet on Charles retiring on the 50th lap now
1ksto6a,"Alex’s thoughts on the F1 Movie:

 Alex: “you should ask max”",,4931,2025-05-22T10:31:50,/r/formula1/comments/1ksto6a/alexs_thoughts_on_the_f1_movie_alex_you_should/,Draconicplayer,280.0,,,
mto7bl8,,,1,2025-05-22T10:38:38,,Draconicplayer,,t3_1ksto6a,t3_1ksto6a,Lmao I just found Ocon did a whole movie review and spoiled some things lol
mto8w5t,,,1,2025-05-22T10:46:02,,QuietLowLife,,t3_1ksto6a,t3_1ksto6a,"Max: why you say fuck me for?    
I was playing my own game."
mto98g9,,,1,2025-05-22T10:47:39,,tadhkanturk18,,t3_1ksto6a,t3_1ksto6a,I love how happy he was with himself hah gotta know you've made it as an F1 driver when you can mess around at a press conference hah
mtobw08,,,1,2025-05-22T11:00:23,,AHugeBear,,t3_1ksto6a,t3_1ksto6a,"Meanwhile, Max: “Dude, not on my PTO.”"
mto9cy8,,,1,2025-05-22T10:48:15,,Ibe121,,t3_1ksto6a,t3_1ksto6a,"I mean, it’s a Hollywood movie so I do expect the subject matter experts to nitpick it. I’m pretty sure geneticists or biologists would find the premise of Jurassic Park laughable; it still made a butt load of money."
mto6o21,,,1,2025-05-22T10:35:33,,swannyhypno,,t3_1ksto6a,t3_1ksto6a,General consensus that the drivers do NOT like this film lmao
mtoa334,,,1,2025-05-22T10:51:42,,dogdad0098089,,t3_1ksto6a,t3_1ksto6a,I imagine it is how we all feel when our profession is portrayed on tv and film.  They get everything wrong and exaggerating things to make it exciting.  Probably the reason doctors are in love the pit.  The show tries its hardest to make things realistic in the medical cases and treatment.
mtobnka,,,1,2025-05-22T10:59:14,,Tyrell-,,t3_1ksto6a,t3_1ksto6a,"If anyone thought this was for hardcore fans they are completely out to lunch. 

This was clearly to capitalize on the growing interest in the sport and convert new fans, which is a good thing. Of course the drivers would be tepid."
mtohm0x,,,1,2025-05-22T11:28:28,,SyuusukeFuji,,t3_1ksto6a,t3_1ksto6a,"I hope someone gets Max and Alex together for an interview or podcast, they were gold together in RBR's content."
mto69q2,,,1,2025-05-22T10:33:39,,Peaking_Ducko,,t3_1ksto6a,t3_1ksto6a,I love this new albon.  Not afraid to be sassy and savage
1ksqdbb,[Autosport] Carlos Sainz on the F1 Movie,,6168,2025-05-22T08:13:14,/r/formula1/comments/1ksqdbb/autosport_carlos_sainz_on_the_f1_movie/,Draconicplayer,439.0,,,
mtnf1el,,,3535,2025-05-22T08:15:40,,Driscuits,,t3_1ksqdbb,t3_1ksqdbb,"Truly an honest, and hilarious review.

The plot's going to be terrible. I can't wait."
mtnf8iz,,,901,2025-05-22T08:16:47,,cripiewalkie,,t3_1ksqdbb,t3_1ksqdbb,"Gonna be a fun watch for the track scenes in IMAX, but I do expect the general plot to be horrible lol"
mtnhhei,,,579,2025-05-22T08:29:16,,Drewski811,,t3_1ksqdbb,t3_1ksqdbb,"This is basically any film about a specialist subject. 

I'm ex-air force. I watch TopGun and think it's garbage from an accuracy point of view. Doesn't stop me enjoying the film for what it is. 

I've been an F1 fan for almost 30 years. Yeah, I'll watch this and think ""x is wrong"", but I'm sure I'm still be able to enjoy the film for the entertainment it is.

If I want a documentary, I'll watch a documentary. I don't watch a Hollywood film for that."
mtnfcc2,,,480,2025-05-22T08:17:24,,MM556,,t3_1ksqdbb,t3_1ksqdbb,"As expected then. ""The most authentic ever"" was always a low bar and a marketing thing "
mtngco2,,,259,2025-05-22T08:23:02,,midniteauth0r,,t3_1ksqdbb,t3_1ksqdbb,“I truly enjoyed it but it was complete horseshit”
mtnfzhx,,,90,2025-05-22T08:20:58,,Preserved_Killick8,,t3_1ksqdbb,t3_1ksqdbb,"Just like top gun

Doesn’t need to be realistic to be enjoyable"
mtnfx3k,,,150,2025-05-22T08:20:37,,MrSnowflake,,t3_1ksqdbb,t3_1ksqdbb,Is Sainz admitting to not knowing anything about F1?
mtnlvhz,,,1,2025-05-22T08:52:57,,consumadojidai,,t3_1ksqdbb,t3_1ksqdbb,Have F1 fans never seen a movie before. It seems like some of you are struggling with the concept of them.
mtnj9ph,,,1,2025-05-22T08:39:05,,AfraidOfTechnology,,t3_1ksqdbb,t3_1ksqdbb,"I don’t care about the plot, I’m not going to watch this movie for the plot, I’m going to watch this movie for big vroomies. That’s all I care about. Did anyone go see Top Gun for the plot? I don’t even remember a single characters name in that movie. You go see a movie like top gun for two reasons:
1. Big fuck-off action scenes 
2. Shirtless volleyball scenes 


Just keepin’ it real"
mtng6dx,,,173,2025-05-22T08:22:03,,Amat-Victoria-Curam,,t3_1ksqdbb,t3_1ksqdbb,You can see they are contractually obligated to not speak their minds publicly about the movie.
1ksnfn5,Lewis Hamilton arriving in style for media day..,,11252,2025-05-22T05:35:33,/r/formula1/comments/1ksnfn5/lewis_hamilton_arriving_in_style_for_media_day/,ShpetimToshi,407.0,,,
mtmrgis,,,1,2025-05-22T05:35:33,,AutoModerator,,t3_1ksnfn5,t3_1ksnfn5,"[The **Photo** flair](https://www.reddit.com/r/formula1/wiki/flairguide#wiki_photo) is for submissions sharing photos from the world of F1. Photos should be interesting and relevant - random photos not notable enough to warrant a standalone post will be subject to removal. This flair should not be used for images which are not photos, such as screenshots, statistical graphics, or artworks.

*[Read the rules](https://www.reddit.com/r/formula1/wiki/userguide). Keep it civil and welcoming. Report rulebreaking comments.*

*I am a bot, and this action was performed automatically. Please [contact the moderators of this subreddit](/message/compose/?to=/r/formula1) if you have any questions or concerns.*"
mtmsl2t,,,852,2025-05-22T05:45:08,,Infinite-Emu1326,,t3_1ksnfn5,t3_1ksnfn5,That MV Agusta in that color is just drop dead gorgeous.
mtmrpyw,,,1176,2025-05-22T05:37:50,,quiqk0,,t3_1ksnfn5,t3_1ksnfn5,"Rossi has made his way to GT3 racing, now waiting for Lewis to go to MotoGP"
mtmud1c,,,563,2025-05-22T05:59:27,,cynictoday,,t3_1ksnfn5,t3_1ksnfn5,This appearing right below the post of Lando driving a moped is a lol
mtmrsnm,,,308,2025-05-22T05:38:27,,stroep,,t3_1ksnfn5,t3_1ksnfn5,That IS a lovely bike. This MV Agusta makes me drool.
mtmsyih,,,191,2025-05-22T05:48:13,,pisscat101,,t3_1ksnfn5,t3_1ksnfn5,MV Agusta F4 LH44 for those afraid to ask.
mtmrxs4,,,509,2025-05-22T05:39:41,,ZugZug58,,t3_1ksnfn5,t3_1ksnfn5,Crazy that Ferrari let him ride around without protective gear on. Apart from the helmet and gloves.
mtmu6qv,,,34,2025-05-22T05:58:04,,MoMoz_1,,t3_1ksnfn5,t3_1ksnfn5,"He did the same in 2019, just look it up. I’ve been in Monaco during race weekend and it’s legit faster just by walking or biking."
mtmrl2y,,,196,2025-05-22T05:36:39,,ChaosKingNando,,t3_1ksnfn5,t3_1ksnfn5,"Ngl, this is drippy af."
mtmvhlz,,,81,2025-05-22T06:08:20,,river_town,,t3_1ksnfn5,t3_1ksnfn5,"A lot of health and safety obsessives in here. People are allowed to manage their own risk, and this seems like a pretty low risk ride through Monaco. 

It's not like he's pushing 80mph down the M1 in just a T-shirt."
1ksvnoq,Franco Colapinto condemns online abuse directed towards Yuki Tsunoda,,2202,2025-05-22T11:51:21,/r/formula1/comments/1ksvnoq/franco_colapinto_condemns_online_abuse_directed/,pixieok,217.0,,,
