id,title,selftext,score,created,permalink,author,num_comments,link_id,parent_id,body
mtomc04,,,1,2025-05-22T11:51:22,,AutoModerator,,t3_1ksvnoq,t3_1ksvnoq,"[The **News** flair](https://www.reddit.com/r/formula1/wiki/flairguide#wiki_news) is reserved for submissions covering F1 and F1-related news. These posts must always link to an outlet/news agency, the website of the involved party (i.e. the McLaren website if McLaren makes an announcement), or a tweet by a news agency, journalist or one of the involved parties.

*[Read the rules](https://www.reddit.com/r/formula1/wiki/userguide). Keep it civil and welcoming. Report rulebreaking comments.*

*I am a bot, and this action was performed automatically. Please [contact the moderators of this subreddit](/message/compose/?to=/r/formula1) if you have any questions or concerns.*"
mtoqd30,,,1,2025-05-22T12:10:27,,WhatsYoursLove,,t3_1ksvnoq,t3_1ksvnoq,"The Argentinians I met at Imola were all very cool and nice, but online seem to be a bunch of assholes"
mton84f,,,1,2025-05-22T11:55:29,,AlejandroG1984,,t3_1ksvnoq,t3_1ksvnoq,As an Argentinian I just want to say: aplogies to both Tsunoda and Doohan's families for our fellow countrymen being a bunch of racists apes. I'm stuck in here with them as well.
mtopjkx,,,1,2025-05-22T12:06:34,,samuelbroombyphotog,,t3_1ksvnoq,t3_1ksvnoq,Good. Right thing to do.
mtoqsq2,,,1,2025-05-22T12:12:27,,TheDudeWithTude27,,t3_1ksvnoq,t3_1ksvnoq,"Somehow at 21 he had more maturity than Canapino who was in his 30s, who just stoked the flames of harassment."
mtoudzp,,,1,2025-05-22T12:29:05,,Annual_Plant5172,,t3_1ksvnoq,t3_1ksvnoq,"I don't go on Facebook much these days, but the odd time that I come across an F1 page, the comments directed towards Lewis Hamilton in particular are just so bleak.

Between that and what Yuki is going through, this is the type of stuff that makes it so hard for non-white people to want to get into auto racing in any capacity, because it can feel like such a hostile environment"
mtopjf5,,,1,2025-05-22T12:06:33,,lDanz-,,t3_1ksvnoq,t3_1ksvnoq,Good man
mtoo0gn,,,1,2025-05-22T11:59:11,,A_Omega_73,,t3_1ksvnoq,t3_1ksvnoq,Racist fans
mtp96s5,,,1,2025-05-22T13:39:22,,DangerRanger_21,,t3_1ksvnoq,t3_1ksvnoq,"Wait so let me get this right… some fans from a country do shitty things online… so now Reddit can say that the whole country is bad, and direct slurs at a driver who’s done nothing wrong…

Make it make sense please…"
mtp5r30,,,1,2025-05-22T13:22:45,,cooperjones2,,t3_1ksvnoq,t3_1ksvnoq,"Good, can now you guys behave here?  

the amount of hateful messages aimed towards all argentines is a bit too much."
1ksxr9t,[visacashapprb via IG] before VS after social filming,https://www.instagram.com/p/DJ9ThzKMXKl/?igsh=YzljYTk1ODg3Zg==,1633,2025-05-22T13:14:31,/r/formula1/comments/1ksxr9t/visacashapprb_via_ig_before_vs_after_social/,Luffy710j,61.0,,,
mtp51x6,,,1,2025-05-22T13:19:24,,droppokeguy,,t3_1ksxr9t,t3_1ksxr9t,Jesus he's LOADED in that first picture
mtp6yqj,,,1,2025-05-22T13:28:35,,Satan_su,,t3_1ksxr9t,t3_1ksxr9t,First pic is how my brain makes me think I look in the gym
mtp7htb,,,1,2025-05-22T13:31:09,,Malt129,,t3_1ksxr9t,t3_1ksxr9t,Didnt know Hadjar was armed
mtpb06c,,,1,2025-05-22T13:48:08,,Skeetzophrenia,,t3_1ksxr9t,t3_1ksxr9t,"I apologize Isack, I wasn’t familiar with your game"
mtpaqjm,,,1,2025-05-22T13:46:50,,HokieTanker,,t3_1ksxr9t,t3_1ksxr9t,"Sir, are you registered to be carrying those across borders?"
mtpcamt,,,1,2025-05-22T13:54:21,,TheDustOfMen,,t3_1ksxr9t,t3_1ksxr9t,"I am looking very respectfully, obviously, but he is JACKED"
mtp4zox,,,1,2025-05-22T13:19:06,,bum_is_on_fire_247,,t3_1ksxr9t,t3_1ksxr9t,Welcome to the gun show
mtpa38d,,,1,2025-05-22T13:43:44,,aboubakertaghoult,,t3_1ksxr9t,t3_1ksxr9t,"Isaak seems a likeable guy,  revelation of the season so far, or have I missed on someone else?"
mtpcmoy,,,1,2025-05-22T13:55:58,,4ksupercockasaurus,,t3_1ksxr9t,t3_1ksxr9t,Love this guy lol. He's so relatable. Him and expedition 33 are driving french popularity stonks right now.
mtptual,,,1,2025-05-22T15:19:55,,Borzoi_Mom,,t3_1ksxr9t,t3_1ksxr9t,"Everything I see from or about Isack makes me like him even more. Fave rookie, hands down."
1ksu7gd,Adrian Newey at the Monaco GP for his first weekend trackside with Aston Martin,,2231,2025-05-22T10:53:31,/r/formula1/comments/1ksu7gd/adrian_newey_at_the_monaco_gp_for_his_first/,Calm-Marionberry5457,71.0,,,
mtoagrb,,,1,2025-05-22T10:53:32,,AutoModerator,,t3_1ksu7gd,t3_1ksu7gd,"[The **Photo** flair](https://www.reddit.com/r/formula1/wiki/flairguide#wiki_photo) is for submissions sharing photos from the world of F1. Photos should be interesting and relevant - random photos not notable enough to warrant a standalone post will be subject to removal. This flair should not be used for images which are not photos, such as screenshots, statistical graphics, or artworks.

*[Read the rules](https://www.reddit.com/r/formula1/wiki/userguide). Keep it civil and welcoming. Report rulebreaking comments.*

*I am a bot, and this action was performed automatically. Please [contact the moderators of this subreddit](/message/compose/?to=/r/formula1) if you have any questions or concerns.*"
mtoha98,,,1,2025-05-22T11:26:51,,Bennet123,,t3_1ksu7gd,t3_1ksu7gd,Man I would be smiling like that too for $30m a year.
mtobpwy,,,1,2025-05-22T10:59:33,,RodrigoF,,t3_1ksu7gd,t3_1ksu7gd,I have never seen this man happy like that lol
mtobkzu,,,1,2025-05-22T10:58:54,,david-crz,,t3_1ksu7gd,t3_1ksu7gd,That boat has never been more aerodynamic
mtogi0k,,,1,2025-05-22T11:23:03,,Upstairs_Bad_9143,,t3_1ksu7gd,t3_1ksu7gd,I always feel that whenever Newey looks at something all he sees is like a Matrix code of drag coefficients and air flow vortices
mtocklh,,,1,2025-05-22T11:03:45,,A_Omega_73,,t3_1ksu7gd,t3_1ksu7gd,Alonso magical pole and win No.33
mtojt5e,,,1,2025-05-22T11:39:20,,2Liq,,t3_1ksu7gd,t3_1ksu7gd,The face of a man who knows he's created a monster of a car for 26. The 33rd win is coming boys.
mtoattz,,,1,2025-05-22T10:55:16,,dogdad0098089,,t3_1ksu7gd,t3_1ksu7gd,I guess there to look at the car and see what not to do for 2026.
mtohgut,,,1,2025-05-22T11:27:46,,tubumechafrieza14,,t3_1ksu7gd,t3_1ksu7gd,Man smiling like he found the formular to a rocketship
mtoik30,,,1,2025-05-22T11:33:09,,Used-Ad1806,,t3_1ksu7gd,t3_1ksu7gd,Alonso pole? OR STROLL POLE?!
1ksnoez,Lando Norris arriving for media day,,5390,2025-05-22T05:50:51,/r/formula1/comments/1ksnoez/lando_norris_arriving_for_media_day/,randomseocb,302.0,,,
mtmta5i,,,1,2025-05-22T05:50:52,,AutoModerator,,t3_1ksnoez,t3_1ksnoez,"[The **Photo** flair](https://www.reddit.com/r/formula1/wiki/flairguide#wiki_photo) is for submissions sharing photos from the world of F1. Photos should be interesting and relevant - random photos not notable enough to warrant a standalone post will be subject to removal. This flair should not be used for images which are not photos, such as screenshots, statistical graphics, or artworks.

*[Read the rules](https://www.reddit.com/r/formula1/wiki/userguide). Keep it civil and welcoming. Report rulebreaking comments.*

*I am a bot, and this action was performed automatically. Please [contact the moderators of this subreddit](/message/compose/?to=/r/formula1) if you have any questions or concerns.*"
mtmtk3s,,,4349,2025-05-22T05:53:04,,Own-Combination2306,,t3_1ksnoez,t3_1ksnoez,At first i was like DAMNNN… Then i saw the last pic 😭😭
mtmtoet,,,1393,2025-05-22T05:54:02,,Saikroe,,t3_1ksnoez,t3_1ksnoez,"I thought it was gonna be a sweet ass motorcycle like Lewis. Thats a moped right?

Coooooolll... ..."
mtmtm5j,,,826,2025-05-22T05:53:31,,gandalftheshai,,t3_1ksnoez,t3_1ksnoez,"Images 1 to 4   
10/10 

Image 5   
2/10"
mtmugr8,,,277,2025-05-22T06:00:15,,plankmeister,,t3_1ksnoez,t3_1ksnoez,The *neck* on the lad...
mtmuuur,,,165,2025-05-22T06:03:22,,MayorAg,,t3_1ksnoez,t3_1ksnoez,Get all the drivers a Vespa and see them race in Monaco!
mtmu9h8,,,257,2025-05-22T05:58:41,,cynictoday,,t3_1ksnoez,t3_1ksnoez,You can't roll in with the cool leather jacket whilst riding a moped lmao
mtn0jvg,,,51,2025-05-22T06:45:19,,Alle_is_offline,,t3_1ksnoez,t3_1ksnoez,ya'll just have no taste. that last picture is the best of the bunch. mopeds go hard
mtmtott,,,93,2025-05-22T05:54:07,,achupakabra,,t3_1ksnoez,t3_1ksnoez,No way that last image is real…I mean why??
mtmu5y2,,,39,2025-05-22T05:57:54,,darkdaysolstice,,t3_1ksnoez,t3_1ksnoez,Lando is practical! 🤣
1kswehj,"Colapinto on gambling: ""I'm trying not to, I don't have money to spend yet""",,1358,2025-05-22T12:20:29,/r/formula1/comments/1kswehj/colapinto_on_gambling_im_trying_not_to_i_dont/,Nikocholas,105.0,,,
mtotiik,,,1,2025-05-22T12:25:05,,freedfg,,t3_1kswehj,t3_1kswehj,I somehow always forget that Monaco is supposed to be a casino town like Vegas. Years of understanding it as a millionaires tax escape has really altered my mental image of it.
mtotkbg,,,1,2025-05-22T12:25:18,,OrganicRun1,,t3_1kswehj,t3_1kswehj,"Finally, I can relate to an f1 driver's struggles."
mtp1q58,,,1,2025-05-22T13:03:29,,tube32129,,t3_1kswehj,t3_1kswehj,No hay plata
mtoxmrm,,,1,2025-05-22T12:44:13,,SyuusukeFuji,,t3_1kswehj,t3_1kswehj,"""No puedo, soy pobre"".

The ""Franco Colapinto e pobre"" (Franco Colapinto is poor) meme will not die any time soon."
mtp2dni,,,1,2025-05-22T13:06:35,,StarmanRiver,,t3_1kswehj,t3_1kswehj,Argentino hasta la médula jajaja
mtq47gd,,,1,2025-05-22T16:10:23,,aCe_aLe,,t3_1kswehj,t3_1kswehj,"20 drivers:
18 millionaires 
1 billionaire
1 Franco Colapinto"
mtpb2kk,,,1,2025-05-22T13:48:27,,Itau3u,,t3_1kswehj,t3_1kswehj,this is the kind of intervied questions I like
mtp2j5m,,,1,2025-05-22T13:07:19,,TheDogFather,,t3_1kswehj,t3_1kswehj,Gambling is for fools. The house always wins.
mtozu0h,,,1,2025-05-22T12:54:31,,franfrant,,t3_1kswehj,t3_1kswehj,Franco Colapinto e pobre
mtpi8v3,,,1,2025-05-22T14:23:16,,Sirtopofhat,,t3_1kswehj,t3_1kswehj,Franco's race purse on the LA Dodgers 1sr basemen Freddie Freeman to get 1 hit and 1 total base.
1kstfv2,"How much are you involved to what your teams are doing for 2026?

Max (joking) : Last few days I was still at the factory designing the pistons. So I think we found a good compromise now I think it’s gonna be a rocketship.",,1767,2025-05-22T10:22:14,/r/formula1/comments/1kstfv2/how_much_are_you_involved_to_what_your_teams_are/,Draconicplayer,52.0,,,
mto580l,,,1,2025-05-22T10:28:39,,Bake2727,,t3_1kstfv2,t3_1kstfv2,Now we know who to blame if the engine goes bam.  /s
mto4hac,,,1,2025-05-22T10:25:06,,Manaea,,t3_1kstfv2,t3_1kstfv2,"good thing you put joking between parentheses, with how he’s been carrying red bull recently I thought he meant that for real /s"
mto4dwp,,,1,2025-05-22T10:24:39,,AvailableSh1rt,,t3_1kstfv2,t3_1kstfv2,Rocketship confirmed 🤓 Franz does it all!
mto5ig6,,,1,2025-05-22T10:30:01,,rapid4roller8,,t3_1kstfv2,t3_1kstfv2,Watch the media take this joke and make it a serious headline with The Race ready to issue their verdict.
mto5gys,,,1,2025-05-22T10:29:49,,VindtUMijTeLang,,t3_1kstfv2,t3_1kstfv2,I think this finally legitimises u/kimiquokka 's assertion that Räikkönen designed and built his car from scratch.
mto5o98,,,1,2025-05-22T10:30:48,,cristiano_goat,,t3_1kstfv2,t3_1kstfv2,“Verstappen gave terrible feedback” agenda if RB22 is ass? /s
mtp047j,,,1,2025-05-22T12:55:51,,YorkshireRiffer,,t3_1kstfv2,t3_1kstfv2,"\*2026 RBR slowly comes to a halt on the side of the track.*

A tramp that the marshalls missed asks a dejected Max what's the matter.

""Piston broke.""

""Me too."" said the tramp."
mto6sq6,,,1,2025-05-22T10:36:10,,ViperFive1,,t3_1kstfv2,t3_1kstfv2,"We christen this rocket ship, the R.B.R. Hermann."
mto4mun,,,1,2025-05-22T10:25:50,,Timelordvictorious1,,t3_1kstfv2,t3_1kstfv2,Max has the funniest sense of humor.
mtp3294,,,1,2025-05-22T13:09:52,,Tame_Trex,,t3_1kstfv2,t3_1kstfv2,I expect the dad jokes to ramp up soon
1ksvjki,"Mercedes AMG F1 | From dreams in 2018... to reality in 2025 Kimi in Monaco, 2018 ↔️ Kimi in Monaco, 2025.",https://www.instagram.com/p/DJ9oRBPNrSO/?igsh=MXM4OXZzMGRscW0zcw==,1201,2025-05-22T11:46:44,/r/formula1/comments/1ksvjki/mercedes_amg_f1_from_dreams_in_2018_to_reality_in/,God_Will_Rise_,9.0,,,
mtolk02,,,1,2025-05-22T11:47:42,,Soggy_Bid_6607,,t3_1ksvjki,t3_1ksvjki,He hasn’t grown much. Give him more soup.
mtoqfjz,,,1,2025-05-22T12:10:46,,Due_Hunt1137,,t3_1ksvjki,t3_1ksvjki,"Does anyone know, when did he started being sponsored by Merc?"
mtp33qc,,,1,2025-05-22T13:10:04,,_hanboks,,t3_1ksvjki,t3_1ksvjki,It's only been 7 years but this only makes me think about how old I am 😭
mtovsic,,,1,2025-05-22T12:35:37,,RevvedUpLikeADeuce09,,t3_1ksvjki,t3_1ksvjki,My life was better so much in 2018 than it is in 2025. I want to rewind the clock.
mtpo23a,,,1,2025-05-22T14:51:56,,whoopsallgone,,t3_1ksvjki,t3_1ksvjki,He’s still a baby 🫶
mtorsat,,,1,2025-05-22T12:17:05,,ElderSkrt,,t3_1ksvjki,t1_mtoqfjz,2018 he joined the junior team
mtr25ft,,,1,2025-05-22T19:20:13,,sadicarnot,,t3_1ksvjki,t1_mtp33qc,I graduated high school in 1984. When I started working in industrial facilities I was the young guy. Now I am the old guy.
1ksqzez,Cars Damage Cost After Imola GP,,1697,2025-05-22T08:40:36,/r/formula1/comments/1ksqzez/cars_damage_cost_after_imola_gp/,JefinLuke,139.0,,,
mtnjk75,,,1,2025-05-22T08:40:38,,AutoModerator,,t3_1ksqzez,t3_1ksqzez,"[The **Statistics** flair](https://www.reddit.com/r/formula1/wiki/flairguide#wiki_statistics) is reserved for posts highlighting interesting statistics. As a rule of thumb, Statistics posts need to inform readers through visualizations and insights that cannot be obtained from raw data alone. For example, a post containing a qualifying gap between two drivers expressed in tenths of a second is an easily obtainable raw piece of data and constitutes a bad Statistics post. A visualization of what that translates to on-track, or visualization of how that gap came to be would constitute a good Statistics post.

*[Read the rules](https://www.reddit.com/r/formula1/wiki/userguide). Keep it civil and welcoming. Report rulebreaking comments.*

*I am a bot, and this action was performed automatically. Please [contact the moderators of this subreddit](/message/compose/?to=/r/formula1) if you have any questions or concerns.*"
mtnleac,,,1,2025-05-22T08:50:25,,EnglishLouis,,t3_1ksqzez,t3_1ksqzez,What was yuki before Imola?
mtnkm0e,,,1,2025-05-22T08:46:16,,FinnJokaa,,t3_1ksqzez,t3_1ksqzez,these dudes have more damage costs tahn i earn in my whole life and i think thats beautiful
mtnnfgp,,,1,2025-05-22T09:01:05,,RooBoy04,,t3_1ksqzez,t3_1ksqzez,"Here’s the original data created by u/basspro24chevy

[link](https://www.reddit.com/r/formula1/s/T79fBsxuG4)"
mtnrdnt,,,1,2025-05-22T09:21:05,,Bossini,,t3_1ksqzez,t3_1ksqzez,I don’t recall Norris’ serious crash?
mtnk665,,,1,2025-05-22T08:43:55,,swannyhypno,,t3_1ksqzez,t3_1ksqzez,Stroll not in the top 10 what a world
mtnnnu0,,,1,2025-05-22T09:02:17,,rye_domaine,,t3_1ksqzez,t3_1ksqzez,"Can't be criticised for your updates not working if you demolish your car, 5D chess from Alpine"
mtnpqua,,,1,2025-05-22T09:12:57,,akwatica,,t3_1ksqzez,t3_1ksqzez,2.05M only? for Yuki destroying the whole car? Im glad he is safe though.
mtnt0w3,,,1,2025-05-22T09:29:14,,lalabadmans,,t3_1ksqzez,t3_1ksqzez,"Monaco is crash central with the tight track and barriers, please my bro Yuki keep it clean this weekend"
mtnnz5d,,,1,2025-05-22T09:03:56,,Priyotosh1234,,t3_1ksqzez,t3_1ksqzez,My GOAT Stroll
1kt163k,Charles Leclerc's helmet for the 2025 Monaco GP,,363,2025-05-22T15:33:06,/r/formula1/comments/1kt163k/charles_leclercs_helmet_for_the_2025_monaco_gp/,Ecomystic,14.0,,,
mtpwl9z,,,1,2025-05-22T15:33:06,,AutoModerator,,t3_1kt163k,t3_1kt163k,"[The **Photo** flair](https://www.reddit.com/r/formula1/wiki/flairguide#wiki_photo) is for submissions sharing photos from the world of F1. Photos should be interesting and relevant - random photos not notable enough to warrant a standalone post will be subject to removal. This flair should not be used for images which are not photos, such as screenshots, statistical graphics, or artworks.

*[Read the rules](https://www.reddit.com/r/formula1/wiki/userguide). Keep it civil and welcoming. Report rulebreaking comments.*

*I am a bot, and this action was performed automatically. Please [contact the moderators of this subreddit](/message/compose/?to=/r/formula1) if you have any questions or concerns.*"
mtq6e3e,,,1,2025-05-22T16:21:35,,Edlar_89,,t3_1kt163k,t3_1kt163k,He ought to put an “I live here” label on the map
mtq973r,,,1,2025-05-22T16:36:51,,ts737,,t3_1kt163k,t3_1kt163k,Dark visor to hide the tears
mtpxtmw,,,1,2025-05-22T15:39:03,,Lobsters4,,t3_1kt163k,t3_1kt163k,"Love the baby blue and the track on top.    

The videos he posted of him playing the piano were very cool.  I could listen to him play all day.  

I hope he has the best weekend possible."
mtpzbpo,,,1,2025-05-22T15:46:16,,DubiousLLM,,t3_1kt163k,t3_1kt163k,That’s so fucking cool with map and track on there.
mtq89ei,,,1,2025-05-22T16:31:22,,CaptGeechNTheSSS,,t3_1kt163k,t3_1kt163k,Not my favorite of his but it’s hard to top some those beauties
mtqa4h3,,,1,2025-05-22T16:41:54,,Electrical_Good9910,,t3_1kt163k,t3_1kt163k,it is so interesting that charles favorite color is almost the same as HPs color.
mtqo865,,,1,2025-05-22T17:59:38,,zingerfillets,,t3_1kt163k,t3_1kt163k,Wow love this !
mtqq47h,,,1,2025-05-22T18:10:16,,willzyx01,,t3_1kt163k,t3_1kt163k,Gotta drown out the pain with cool helmets
mtqh2qh,,,1,2025-05-22T17:19:20,,queerhedgehog,,t3_1kt163k,t3_1kt163k,"Not my favorite of his, but it’ll look good with their special suits and I like the map on top a lot!"
1kswuvx,Sainz casually chilling with his bros Pogi and Ollie on a cycling run in Monaco (his insta),,472,2025-05-22T12:38:46,/r/formula1/comments/1kswuvx/sainz_casually_chilling_with_his_bros_pogi_and/,rinamy,57.0,,,
mtp0tk4,,,1,2025-05-22T12:59:09,,Pitforsofts,,t3_1kswuvx,t3_1kswuvx,Those Bearman-giraffe neck memes had some truth to them after all. Dude could peak into alpines garage without leaving his own.
mtp2ck1,,,1,2025-05-22T13:06:26,,mshell1924,,t3_1kswuvx,t3_1kswuvx,"Carlos is one of thee few drivers whose neck looks proportionate lol.

Nice to see him with Bearman again, they seem to be close. I remember in that one race he was like ""Ciao!"" after an overtake, he actually came out in an interview and said ""omg the editing was deceiving, I would never say that to Carlos!""

(and then he very casually said ""I said it to Lawson! 😎"")"
mtoy0jy,,,1,2025-05-22T12:46:00,,TyButler2020,,t3_1kswuvx,t3_1kswuvx,I don’t know why but Sainz’s expressions and poses just unintentionally crack me tf up
mtp8jmj,,,1,2025-05-22T13:36:16,,trautsj,,t3_1kswuvx,t3_1kswuvx,Casually cycling with a multi time Tour de France winner... no big deal lol
mtowx8f,,,1,2025-05-22T12:40:55,,rinamy,,t3_1kswuvx,t3_1kswuvx,"Insta post here:  https://www.instagram.com/p/DJ9JrA-oJ9v/

&nbsp;

Love seeing the interteam friendships.  For those of you who don't follow cycling, Tadej Pogačar is one of the top cyclists in the world and Sainz has recorded hanging out with him at least a few times."
mtox6al,,,1,2025-05-22T12:42:05,,adorgu,,t3_1kswuvx,t3_1kswuvx,It looks like the guy with the mustache is wearing fake eye glasses.
mtp7311,,,1,2025-05-22T13:29:10,,Retrojuxtapose,,t3_1kswuvx,t3_1kswuvx,I was today years old when I learned that Sainz was friends with Tadej Pogačar! I love my two favorite sports intersecting like that.
mtpka7a,,,1,2025-05-22T14:33:20,,ValenciaFilter,,t3_1kswuvx,t3_1kswuvx,Pogacar to Williams *confirmed*
mtpg406,,,1,2025-05-22T14:12:49,,Adammmmski,,t3_1kswuvx,t3_1kswuvx,Is this new as Sainz cycled with Pogi last year?
mtpkoy7,,,1,2025-05-22T14:35:22,,Baker-Puzzled,,t3_1kswuvx,t3_1kswuvx,Really? The only time Valtteri doesn't show up?
1kt6ei8,Priorities.,,132,2025-05-22T19:29:13,/r/formula1/comments/1kt6ei8/priorities/,MemoryTM,12.0,,,
mtr3mw9,,,1,2025-05-22T19:29:14,,AutoModerator,,t3_1kt6ei8,t3_1kt6ei8,"[The **Photo** flair](https://www.reddit.com/r/formula1/wiki/flairguide#wiki_photo) is for submissions sharing photos from the world of F1. Photos should be interesting and relevant - random photos not notable enough to warrant a standalone post will be subject to removal. This flair should not be used for images which are not photos, such as screenshots, statistical graphics, or artworks.

*[Read the rules](https://www.reddit.com/r/formula1/wiki/userguide). Keep it civil and welcoming. Report rulebreaking comments.*

*I am a bot, and this action was performed automatically. Please [contact the moderators of this subreddit](/message/compose/?to=/r/formula1) if you have any questions or concerns.*"
mtr7xv5,,,1,2025-05-22T19:55:03,,SuitednZooted,,t3_1kt6ei8,t3_1kt6ei8,That anniversary edition setup is definitely a lowkey flex. 👏
mtr67j8,,,1,2025-05-22T19:44:48,,TheKnightofValencia,,t3_1kt6ei8,t3_1kt6ei8,"These are the best of times, the man doesn't know it yet"
mtr6205,,,1,2025-05-22T19:43:53,,Dapper_Fold9854,,t3_1kt6ei8,t3_1kt6ei8,dude has EVERYTHING
mtr7r28,,,1,2025-05-22T19:53:55,,HolidayWheel5035,,t3_1kt6ei8,t3_1kt6ei8,Love that you felt the need to add the M…. Pretty sure we could’ve guessed at that part 😉
mtrdy51,,,1,2025-05-22T20:31:09,,grinchsucker,,t3_1kt6ei8,t3_1kt6ei8,ONE OF US
mtr5ieb,,,1,2025-05-22T19:40:38,,darklordjames,,t3_1kt6ei8,t3_1kt6ei8,I see no problem here. Thumbs up.
mtraqli,,,1,2025-05-22T20:11:44,,bwoah07_gp2,,t3_1kt6ei8,t3_1kt6ei8,"* Chair
* PS5
* F1
* Adequate lighting

10/10, nice space! 👏👏"
mtr8q6d,,,1,2025-05-22T19:59:42,,Honourstly,,t3_1kt6ei8,t3_1kt6ei8,Hell yeah!
mtr9jm9,,,1,2025-05-22T20:04:36,,Digitaluser32,,t3_1kt6ei8,t3_1kt6ei8,Everything looks great! It's all downhill from here.
1ksmlbb,"""Oscar, do you think this is plan C?"" ""Yes"" - Radio messages show why McLaren's drivers ended up on different strategies at Imola",,1952,2025-05-22T04:39:35,/r/formula1/comments/1ksmlbb/oscar_do_you_think_this_is_plan_c_yes_radio/,kcollantine,219.0,,,
mtmlfky,,,1,2025-05-22T04:39:35,,AutoModerator,,t3_1ksmlbb,t3_1ksmlbb,"[The **News** flair](https://www.reddit.com/r/formula1/wiki/flairguide#wiki_news) is reserved for submissions covering F1 and F1-related news. These posts must always link to an outlet/news agency, the website of the involved party (i.e. the McLaren website if McLaren makes an announcement), or a tweet by a news agency, journalist or one of the involved parties.

*[Read the rules](https://www.reddit.com/r/formula1/wiki/userguide). Keep it civil and welcoming. Report rulebreaking comments.*

*I am a bot, and this action was performed automatically. Please [contact the moderators of this subreddit](/message/compose/?to=/r/formula1) if you have any questions or concerns.*"
mtmmvpg,,,1101,2025-05-22T04:53:37,,Working_Sundae,,t3_1ksmlbb,t3_1ksmlbb,McLaren is a top team with midfield strategists
mtmlxzd,,,1150,2025-05-22T04:44:38,,silenthills13,,t3_1ksmlbb,t3_1ksmlbb,"Lando would be sent to the shadowrealm for this ngl. But yeah, this is the sort of thing that happened in Sochi when Lando lost out. They're just barraging the drivers with useless info and questions and making them make their decision, when in reality the driver should only make the decision when he's 150% sure it's a good one for some reason."
mtmmxp2,,,229,2025-05-22T04:54:08,,Ruzza1180,,t3_1ksmlbb,t3_1ksmlbb,"McLarens strategy department has one of two potential issues, Will or Skill. They either CANT make decisive actions based on what the data tells them or they don’t WANT to make decisive actions. 

Your driver has such a minimal amount of data compared to the team, adding in that the pit-wall knew they were dropping Oscar into traffic, even before his slow stop. 

It was poor and unfortunately has been happening a lot from McLaren over the last year"
mtmyspd,,,33,2025-05-22T06:32:59,,MemestNotTeen,,t3_1ksmlbb,t3_1ksmlbb,They pitted Oscar because he was struggling. They didn't know the tyre was going to come back. If they waited one more lap he would have pitted behind Leclerc
mtmlq2j,,,456,2025-05-22T04:42:30,,One_Client4409,,t3_1ksmlbb,t3_1ksmlbb,Oscar did a Lando. McLaren ought to stop confusing the drivers with choices - they do not have all the information to optimise the strategy. FFS you can't make a strategy choice from inside the cockpit unless you are Carlos Sainz talking to the Ferrari pit wall.
mtmtlyt,,,54,2025-05-22T05:53:29,,AliceLunar,,t3_1ksmlbb,t3_1ksmlbb,"I feel like it's not as big of a deal as people are making it out to be, Piastri did not have the pace to catch Verstappen and his tires weren't feeling good, going for an undercut wasn't a crazy decision at that point.

Norris might have done the same thing if it wasn't for Leclerc already having undercut him and they'd lose position to him so they opted to go long instead, a problem Piastri did not have, but if he did stay out longer, they would risk the same thing."
mtmmvgr,,,138,2025-05-22T04:53:33,,HorizonGaming,,t3_1ksmlbb,t3_1ksmlbb,If they didn’t consult Oscar and then they made the wrong choice y’all would be in here complaining how the pit wall didn’t ask Oscar what he thought.
mtmrhzf,,,10,2025-05-22T05:35:55,,biometricrally,,t3_1ksmlbb,t3_1ksmlbb,I really enjoy these style articles from racefans
mtms58q,,,21,2025-05-22T05:41:27,,ecobubbletm,,t3_1ksmlbb,t3_1ksmlbb,">“Remember Saudi Arabia,” Piastri’s race engineer Tom Stallard told him

A bit confusing to me cause in Saudi Max had a penalty that helped Piastri get ahead

>It’s going to be a while though, it’s better just to do a Safety Car.

Cheeky Lando, wanting SC to bunch the pack up to be able to have a go at Max"
1kspof9,Ollie Bearman's special helmet for Monaco,,1070,2025-05-22T07:40:10,/r/formula1/comments/1kspof9/ollie_bearmans_special_helmet_for_monaco/,randomseocb,46.0,,,
